coroner_concerns,coroner_name,reff_id,report_sent_to
"<td class=""govuk-table__cell""><strong><u>CORONER’S CONCERNS</u></strong> <strong> </strong> <br>During the course of the inquest, the evidence revealed matters giving rise to concern. <strong> </strong> In my opinion there is a risk that future deaths will occur unless action is taken. In the circumstances it is my statutory duty to report to you. <strong> </strong> <br><br>The <strong>MATTERS OF CONCERN </strong>are as follows <br>a.       The Investigation undertaken by the Health Board was deficient in that it did not contain pertinent points relating to how the transfer of care did not occur. I have previously issued a number of Prevention of Future Death Reports relating to quality and timeliness of investigation.<br><strong> </strong><br>b.      The Health Board’s Transfer of Care document at the time the transfer occurred did not include any detail or process as to how the transfer should occur. The amended policy has still not been finalised and there remains a concern that deaths will continue to occur if the process is not finalised and shared widely within the Health Board to staff.<br><strong> </strong><br>c.       Patient notes for mental health are still not electronic; they are paper based. I have issued several Prevention of Future Death Reports specifically relating to this. There has been considerable delay in actioning this and yet there is still not anticipated timescale for this to occur. As such, deaths will continue to occur or may occur into the future with the risk that notes are paper based only. The risk relates to only one department or individual having access to them at once when there is wider support for the patient.</td>",,Ref: 2023-0333,
"<td class=""govuk-table__cell""><strong>CORONER’S CONCERNS</strong><br>During the Inquest, the evidence revealed matters giving rise to concern. A number of these have been addressed and do not require a PFD report.<br><strong> </strong><br>I have also considered a report by HM Chief Inspector of Prisons, “The experience of immigration detainees in prisons,” dated September 2022. Some of the key concerns in that report mirror concerns I came to independently having heard the evidence in this Inquest. Published responses to the report suggest some concerns are being addressed, albeit it is not clear if they have been resolved.<br><strong> </strong><br>In my opinion there is a risk that future deaths will occur unless action is taken. In the circumstances it is my statutory duty to report to you.<br><strong> </strong><br>The <strong>MATTERS OF CONCERN</strong> are as follows:<br>1.      Although the specific issues below were not left to the jury as “causative matters” in this Inquest, I am concerned about the potential impact of these issues in other cases.<br><strong><u>Timing of IS91 notification.</u></strong><br><strong> </strong><br>2.      The timing of the notification to Mr Santos by the SSHD that he was not to be released at the end of his custodial sentence but was to be held on immigration detention pending a decision on deportation. The SSHD target for notification is 30 days prior to release. In this case it was 8 days late. I heard PFD evidence that this 30-day target is not met in 40% of cases and that 83% of cases are notified within 7 days of the end of the sentence. I am concerned at the potential uncertainty and distress caused to Foreign National Offenders (“FNOs”) by notification at this stage.<br><strong><u>Signposting legal advice about immigration matters</u></strong><br><strong> </strong><br>3.      Mr Santos signed a form on 24 October 2020 to receive support from a charity supporting immigration detainees. Bail forms were sent to them by the prison on 29 October 2020.<br>4.      I am concerned as to how access to legal advice is facilitated and signposted.<br>5.      In PFD evidence, I was informed that FNOs (in a similar position to Mr Santos) are now entitled to 30 minutes of free legal advice following a High Court decision in February 2021. In HMP Belmarsh, this entitlement is displayed on a notice in each Houseblock. I am concerned that displaying a notice is insufficient to draw this entitlement to the attention of FNOs. I do not know if this is a wider issue in other prisons. Understanding of immigration status, including appeal and bail procedures and is complex. Access to legal advice is vital to prevent confusion.<br><strong><u>Communication between agencies</u></strong><br><strong> </strong><br>6.      Communication issues between the agencies dealing with immigration and sentence planning may lead to confusion and uncertainty for FNOs.<br>7.      I appreciate that any legal advice to FNOs should be from a legal adviser. I am encouraged that the probation service (who employ community offender managers) is seeking to develop a cohort of probation officers specialising in FNOs and immigration. There are now 201 SPOCs across 12 regions and a hub lead developing this model and leading engagement with the SSHD. There is no such model in the prison in respect of “prison offender managers” who also liaise with the SSHD about FNOs.<br><strong> </strong><br><strong><u>Delays by SSHD and Probation and failure to obtain information.</u></strong><br><strong> </strong><br>8.      I am concerned at the potential impact of delays/failure to obtain information in other cases. In Mr Santos’ case there were delays by probation in allocating a community offender manager and providing an up-to-date OASYS report. There were also delays by the SSHD progressing Mr Santos’ case, including issue of the Stage 2 letter, failure to obtain medical records and delay in requesting the OASYS report.<br>9.      I am encouraged that there is now a centralised system (and form) for the SSHD to request OASYS reports from probation although it is not clear the extent to which requests are going through this system. Consent to obtain medical information is sought from FNOs at an induction meeting by Immigration Prison Teams (“IPTs”). Further IPT officers attend prisons and play a key role in obtaining this type of information. However it is not clear what systems are in place to facilitate the obtaining of medical information.<br><strong><u>The SSHD Internal report</u></strong><br><strong> </strong><br>10.    The SSHD disclosed an Internal report into Mr Santos’ case midway through the Inquest, which was not on his Home Office file. The lawyers representing the SSHD were unaware of this report. The head of FNO Returns Command only became aware of it the preceding week and understood it had been disclosed.<br>11.    The report detailed delays and issues in Mr Santos’ case and the SSHD then made formal admissions of the relevant (non-causative) failures which were recorded by the jury in the Record of Inquest at my direction.<br>12.    This report was dated February 2021 and listed action points for the relevant department. Although I am told that these are now being addressed, I am concerned that important learning points (which could prevent future deaths) were not disseminated and actioned as they should have been.<br><br><strong><u>Opening cell doors at night</u></strong><br>13.    In evidence there was a continued misunderstanding that the policy did not apply to Operational Support Grade (OSG) officers and it was understood that they should never open cell doors at night. This was despite the PPO report dated December 2021 (at paragraph 73) requesting this be addresses 14.    The prison stated in PFD evidence that all staff will be instructed as to the policy in terms of opening cell doors at night (which requires a dynamic risk assessment).<br>15.    I remain concerned that this appears to be a longstanding belief held by experienced officers.</td>",Coroner name: Jenny Goldring,Ref: 2023-0361,This report is being sent to: HMP Belmarsh | Practice Plus Group | Home Office | HM Prison and Probation Service | Ministry of Justice
"<td class=""govuk-table__cell""><strong><u>CORONER’S CONCERNS</u></strong><br>During the course of the inquest the evidence revealed matters giving rise to concern. In my opinion there is a risk that future deaths could occur unless action is taken. In the circumstances it is my statutory duty to report to you.<br><strong> </strong><br>The <strong>MATTERS OF CONCERN </strong>are as follows. <br><strong> </strong><br>The Inquest identified multiple failings in the care provided to Allison. The failings occurred within a children and adolescent mental health service which was significantly under resourced.<br><strong> </strong><br>The Inquest heard evidence that the under resourcing of CAMHS services is not confined to this local Trust but is a matter of National concern.<br><strong> </strong><br>The under resourcing of CAMHS services contributed to delays in Allison being assessed by the mental health team. The delay between triage to assessment was 9 months. The Inquest heard evidence that this delay is not unusual within CAMHS teams across the country.<br><strong> </strong><br>There was very little evidence of any consultant psychiatrist leadership within the CAMHS team. The Inquest heard of the difficulties in recruiting suitably qualified psychiatrists to CAMHS teams.<br><strong> </strong><br>The Inquest heard that funding for CAMHS teams within the allocation of funding for general mental health is poor.<br><strong> </strong><br>The Inquest heard that the number of children presenting to CAMHS teams is increasing significantly. The number of referrals of children to the local CAMHS team in the early 2010s was between 10 – 12 per week.  The current number of referrals is in the region of 140 patients per week.<br><strong> </strong><br>There is a concern that ongoing under resourcing of CAMHS services (whilst demand continues to increase), will result in future similar deaths.</td>",Coroner name: Nadia Persaud,Ref: 2023-0313,This report is being sent to: North East London Foundation Trust | North East London Health and Care Partnership | Royal College of Paediatrics and Child Health | Royal College of Psychiatrists | Department for Health & Social Care
"<td class=""govuk-table__cell""><strong>CORONER’S CONCERNS</strong><br>During the course of the inquest, the evidence revealed matters giving rise to concern. In my opinion, there is a risk that future deaths will occur unless action is taken. In the circumstances, it is my statutory duty to report to you.<br><strong> </strong><br>The <strong>MATTERS OF CONCERN </strong>are as follows.<br>I received evidence, in particular from the investigating officer (OIC), who dealt with the investigation into the allegation against Mr Leger, and from an investigator from the Metropolitan Police’s Directorate of Professional Standards (DPS), who conducted an investigation on behalf of the IOPC into the way in which the criminal investigation was undertaken, in particular the consideration of Mr Leger’s welfare and support offered to<br>him.<br><br><strong> </strong><br>I heard evidence:<br><strong> </strong><br>·       That when a person who has been RUI’d is charged, standard practice (in accordance with current Metropolitan Police policies and procedures) is for that charge to be communicated to them via a PCR with no advance warning.<br><strong> </strong><br>·       That this is the case regardless of the offence, or seriousness of the offence, with which they are being charged.<br><strong> </strong><br>·       That in exceptional circumstances, where an individual is considered to be in a high-risk category, arrangements can be made for the PCR to be delivered in person and/or for a third party to be present to provide support.<br><strong> </strong><br>·       That it is recognised that certain types of allegation, such as a sexual allegation (as was the case here), may carry a higher risk. This, of itself, does not place an individual into a high-risk category for the purposes of delivering the news that they are to be charged (by way of a PCR).<br><strong> </strong><br>·       That whether an individual is, exceptionally, considered to be in a high-risk category (such as to cause a PCR to be delivered in person) is reliant on information about their mental health coming to the attention of the OIC. There is no formal requirement for the OIC proactively to seek this information.<br><strong> </strong><br>·       That there is no formal process for assessing an individual’s mental health and/or risk of suicide or self-harm at the time of delivery of a PCR.<br><strong> </strong><br>It is important to note the following:<br><strong> </strong><br>·       At the point of charge, nothing has been proven against the individual concerned. They face an allegation, and are innocent if and until proven guilty to the criminal standard.<br><strong> </strong><br>·       Many people are RUI’d. As such, PCR is now routinely used to bring most criminal charges.<br><strong> </strong><br>·       Individuals who have been RUI’d can remain with this status for long periods of time (months or years) before a decision is made whether or not to charge them.<br><strong> </strong><br>·       Whilst there are formal procedures to assess an individual’s mental health and risk of self-harm or suicide when they attend a<br>police station for interview, once they have left the police station there are no such formal procedures (as above), notwithstanding the potential for a substantial period to elapse between the time they last attended a police station and the time that they are charged.<br><strong> </strong><br>·       Being charged with any criminal offence, especially one which carries the potential for a custodial sentence, can, self-evidently, have a significant deleterious effect on an individual’s mental health.<br><strong> </strong><br>It appears to me that, in the absence of a formal mechanism to assess, at the time of being charged, an individual’s mental health and risk of suicide or self-harm, there is an obvious risk of individuals in the future taking their own lives as a result of being charged by way of a PCR (potentially following a lengthy period of having been RUI’d and potentially months or years since there was last any consideration by the police of their mental health and risk of suicide or self-harm).<br><strong> </strong><br>In Mr Leger’s case, the relevant policies and procedures were those of the Metropolitan Police. However, these issues clearly arise at a wider (national) level and, as head of the College of Policing, you have overall responsibility for policies/guidance disseminated at a national level.</td>",Coroner name: Adam Smith,Ref: 2023-0314,This report is being sent to: College of Policing and Metropolitan Police
"<td class=""govuk-table__cell""><strong><u>CORONER’S CONCERNS</u></strong><br>During the course of the inquest the evidence revealed matters giving rise to concern. In my opinion there is a risk that future deaths will occur unless action is taken. In the circumstances it is my statutory duty to report to you.<br><strong> </strong><br><br>The <strong>MATTERS OF CONCERN </strong>are as follows:<br><strong> </strong><br>(1)  The evidence revealed that there was an inconsistent approach taken by staff when conducting and recording observations on prisoners subject to the Prison Service suicide and self-harm prevention procedures (known as ACCT).<br>(2)  The evidence also revealed that some Officers had a different interpretation of the requirements of set out in PSI 64/2011 in respect of the timing of observations.<br>(3)  The evidence also revealed that precise times of such observations were not routinely being recorded accurately.<br>(4)  During the evidence it became apparent that a prison officer worked 23 hours out of 24, he was asked if this was normal and he replied, “yes, to make the regime work.”</td>",Coroner name: Philip Spinney,Ref: 2023-0341,This report is being sent to: Exeter Prison
"<td class=""govuk-table__cell""><strong><u>CORONER’S CONCERNS</u></strong><br>During the course of the inquest the evidence revealed matters giving rise to concern. In my opinion there is a risk that future deaths could occur unless action is taken. In the circumstances it is my statutory duty to report to you.<br><em> </em><br>The <strong>MATTERS OF CONCERN </strong>are as follows. <br>(1)  It was evident that the lack of consistency in staff dealing with Mr Donoghue’s care was a factor in his ability to engage and be honest with those having oversight of him at a very fragile time in his treatment.<br><br>(2)  Evidence was heard that the HBTT system is a nationwide treatment as an alternative to hospital admission and although peoples’ care in HBTT had improved, a real continuity of staff could only occur with a substantive change which would include additional funding, recruitment of appropriate staff and an ability to retain staff. I was informed that if these issues were addressed it would allow more capacity to manage consistency alongside the other demands of the service.<br><br>(3)  It is worthy of note that this is the 2nd inquest heard within 3 weeks in this jurisdiction whereby inconsistency of care staff has been cited as an issue in a suicide. The other inquest was the death of a 20 year old woman.<br><br>(4) Mental Health is a rising problem and it is my understanding that 115 people die by suicide every week. Acknowledgement of the important work undertaken by HBTT and the need to give the very best support to those who have taken the, often difficult, step of seeking help with their care is a matter that requires imminent attention.</td>",Coroner name: Lorraine Harris,Ref: 2023-0363,This report is being sent to: Department of Health and Social Care
"<td class=""govuk-table__cell""><strong>CIRCUMSTANCES OF DEATH</strong> <br>At 22:38 hours on 19 February 2023, [REDACTED] was found unresponsive the allowing  morning and taken to the Royal Oldham Hospital where he underwent surgery to stem the extensive bleeding. Despite best supportive care, he died at the Royal Oldham Hospital on 21 February 2023. <br><br>The Deceased had been released on bail from Worcester Police Station at 00:33 hours on 19 February 2023 after being detained for 24 hours. In the hours before his arrest, he had been identified by West Marcia Police as a high risk missing person because he had made threats to end his life. On arrival at the police station, the Custody Sergeant took steps to address the Deceased’s risk of suicide by removing his belt, providing him with a rip proof blanket and making a referral to the Liaison and Diversion Service. The referral form included the fact that the Deceased had made threats to end his life. <br><br>The Liaison and Diversion Practitioner (the Practitioner) attended the Deceased’s cell at 10:03 hours on 18 February. A conversation took place through the observation hatch in the cell door which consisted of enquiring whether the Deceased wanted any help with unmet needs or vulnerabilities. During the conversation, the Deceased told the Practitioner that his thought of suicide had been a reaction to the allegations for which he was arrested and that these had now passed. The Court found that this conversation did not equate to a full assessment of the Deceased’s risk of suicide or self-harm. Furthermore, the Practitioner indicated that it was not his role to assess whether the Deceased presented a risk of suicide or self-harm on release from custody. <br><br>The Practitioner made no entry of his contact with the Deceased in the Detention Log. The Court found that there was a lack of clarity in the handover information given to the police as to what, if any, assessment had taken place.</td>",Coroner name: Catherine McKenna,Ref: 2023-0366,This report is being sent to: Midlands Partnership NHS Foundation Trust
"<td class=""govuk-table__cell""><strong>CORONER’S CONCERNS</strong><br>During the course of the investigation my inquiries revealed matters giving rise to concern. In my opinion there is a risk that future deaths could occur unless action is taken. In the circumstances it is my statutory duty to report to you.<br> <br>The <strong>MATTERS OF CONCERN </strong>are as follows:<br>(brief summary of matters of concern)<br> <br>The deceased was prescribed [REDACTED] by her GP.<br>Following discharge from hospital on 18th January 2023  LCH also prescribed [REDACTED]. The deceased therefore had two prescriptions of the same medication that she used to end her life.<br>Are there any checks in place to avoid duplicity of prescriptions between hospital and GP ?</td>",Coroner name: Paul Cooper,Ref: 2023-0368,"This report is being sent to: Suicide (from 2015) | Alcohol, drugs medication related death | Hospital Death (Clinical Procedures and medical management) related deaths"
"<td class=""govuk-table__cell""><strong>CORONER’S CONCERNS</strong>   <br>During the course of the inquest the evidence revealed matters giving rise to concern.     <br><br>The <strong>MATTERS OF CONCERN </strong>are as follows:<br> <br>1.       There continues to be a chronic lack of resources to treat seriously mentally ill patients in Birmingham and Solihull. In the summer of 2022 Birmingham and Solihull Mental Health Trust (‘BSMHFT’) wanted to admit the deceased to an inpatient psychiatric unit, however, no bed was available, and he remained in the community. Shortly before his death, the deceased had been detained by the police under section 136 of the mental health act. There was no available ‘place of safety’ and he had to be taken to an emergency department. The police, BSMHFT, and hospital Drs agreed the deceased needed to be assessed under the mental health act, however Birmingham City Council could not provide an approved mental health practitioner (‘AMPH’) to attend in a 24-hour period. When the section 136 lapsed the deceased was discharged home after a review by a mental health nurse. At the time of his death the deceased was on BSMHFT’s waiting list for a care- coordinator. The lack of care-coordinators, mental health inpatient beds, ‘place of safety’, and AMHPs, presents a risk seriously mentally ill people are not receiving necessary treatment. The evidence is that these issues are a consequence of a chronic lack of resources at a local and national level. The Birmingham and Solihull coroners have been repeating identical concerns in Prevention of Future Death Reports for many years.<br><br>2.       BSMHFT utilizes self-contained specialist teams. The deceased was treated by (a) crisis team/home treatment team, (b) community mental health team, and (b) psychiatric liaison team. The evidence demonstrated communication between the specialist teams was not effective and this caused delays. For example, the psychiatric liaison team nurse that reviewed the deceased updated the community mental health team. However, the GP could not prescribe the deceased’s medication in October 2022 because it had not been approved by the community mental health team consultant via an ESCA and the deceased went without his medication. The deceased’s GP had to contact the community mental health team directly notwithstanding the psychiatric liaison nurse’s involvement. The deceased cited this delay as making his mental health worse shortly before his death. My concern is communication between the specialist teams is not effective enough. BSMHFT’s RCA action plan is to seek assurance from the CCG/ICB that communication between the specialist teams is being strengthened. My concern is that this does not go far enough and there should be consideration of a formal process or policy.<br><br>3.       Carbamazepine management was proposed in 2012 to manage the deceased’s mental health however this was not picked up by his GP and was only noted by a BSMHFT consultant in August 2022. Therefore, the deceased went 10 years without this medication. BSMHFT could not explain at the inquest why this omission had not been identified sooner. BSMHFT’s RCA action plan does not have any action to avoid a repeat occurrence. My concern is this issue indicates a problem with process and systems and further consideration is required to avoid a repeat occurrence.<br><br>4.       The deceased’s GP raised concerns that different health organisations use different digital systems that do not communicate with each other. Further, GPs often do not get important patient updates from primary care organisations for many days or weeks. (See examples above: the GP did not pick up the carbamazepine prescription, and could not prescribe the medication in October 2022). My concern is communication between different health organisations is not as effective as it could be and important information is being missed, and consequently a material delay in treatment is occurring.<br><br>5.       The deceased’s GP raised concerns that current resources do not allow GPs to pro- actively check patients are collecting prescribed medication due to excessive patient lists. My concern is that this is a consequence of lack of resources at a national level.<br> <br>In my opinion there is a risk that future deaths will occur unless action is taken. In the circumstances it is my statutory duty to report to you.</td>",Coroner name: James Bennett,Ref: 2023-0244,"This report is being sent to: Department of Health and Social Care, NHS England, NHS Digital, Birmingham and Solihull Integrated Care Board, Birmingham and Solihull Mental Health NHS Trust and Birmingham City Council"
