coroner_concerns,coroner_name,reff_id,report_sent_to
"<td class=""govuk-table__cell""><strong>CORONER’S CONCERNS</strong><br>During the course of the inquest the evidence revealed matters giving rise to concern. In my opinion there is a risk that future deaths will occur unless action is taken. In the circumstances it is my statutory duty to report to you.<br><strong> </strong><br>The <strong>MATTERS OF CONCERN</strong> are as follows. <br><br>1.     The inquest heard evidence that the backlogs for therapy were such that the waiting list at the time she was assessed as being appropriate for step 4 therapy had a two year wait time. Since that time the waiting period had not decreased and was now between 2 -3 years in both primary and secondary care. This was due to a shortage of trained therapists and demands on the service and was a national issue not specific to the CWP trust.<br><strong> </strong><br>2.     The inquest was told that the trust had since Michelle’s death recognised that the lack of ownership created through the application of its referral and discharge policy internally carried an unacceptable risk. Significant changes had been made. However it was unclear if nationally the lesson had been shared and that other mental health trusts had taken similar steps.<br><br>3.     The evidence before the inquest was that there needed to be a clear understanding by all prosecuting authorities of the impact of a prosecution on someone with a complex mental health background such as Michelle. In Michelle’s case the BTP file reviewer (the nature of the offence Michelle faced meant that it was not a CPS lawyer who made the charging decision) had not correctly applied the public interest test and had not considered the mental health/vulnerability of Michelle Jennings as required to. As a consequence a decision was taken to prosecute her without an assessment of the impact on Michelle and her case was dealt with by the Magistrates Court without them being given the full background in relation to her deteriorating mental health. BTP are as a consequence of Michelle’s death taking steps to address how their prosecution teams should deal with the public interest test and gather information where mental health is an issue. However there is no clear mechanism for such learning and changes (to reduce the risk to life) in relation to vulnerable people such as Michelle to be implemented within the other 42 Police Forces in England and Wales or within other agencies responsible for prosecuting criminal offences.</td>",Coroner name: Alison Mutch,Ref: 2023-0220,This report is being sent to: Department of Health and Social Care and Ministry of Justice
"<td class=""govuk-table__cell""><strong>CORONER’S CONCERNS</strong><br>The <strong>MATTER OF CONCERN </strong>is:<br>There is a risk of a future reoccurrence of the situation which arose on 14 June 2022 given that SECAMBS is regularly operating at Stage 4 of its Surge Management Plan, meaning that demand for the service is significantly outstripping available resources and the service is not capable of responding to calls within target timeframes.</td>",Coroner name: Anna Crawford,Ref: 2023-0212,This report is being sent to: South East Coast Ambulance Service and Department of Health and Social Care
"<td class=""govuk-table__cell""><strong>CORONER’S CONCERNS</strong><br>During the course of the investigation my inquiries revealed matters giving rise to concern. In my opinion there is a risk that future deaths could occur unless action is taken. In the circumstances it is my statutory duty to report to you.<br> <br>The <strong>MATTERS OF CONCERN </strong>are as follows:<br>(brief summary of matters of concern)<br> <br>The concerns arising out of this investigation and inquest relate to the following key areas,<br>a)  Safeguarding<br>b)  Mental health provision<br>c)  Inter-agency communication – particularly where there is some doubt over who should provide additional support needed by a person.<br> <br>We heard in evidence that in the months after Lucy’s death, a Safeguarding Adults Board considered the case, but did not consider that a Safeguarding Adults Review (‘SAR’) should be undertaken. Evidence from Wokingham Borough Council was that they were not at that time aware of the number of safeguarding referrals that had been made.<br> <br>A decision was made (some six days before the inquest) that a SAR will now be conducted. The evidence of the Assistant Director of Adult Social Care was that this is likely to be completed within 1-3 months after the inquest.<br> <br>I have set out the issues / concerns that I have for each of the two recipients of this report, below.<br> <br><strong>Reading Borough Council</strong><br>1)  Time scales for review and triage of safeguarding referrals.<br>2)  Requirements to speak to the individual about whom safeguarding concerns have been raised.<br>3)  Training around Section 42 and when a report meets the threshold for neglect or abuse. This training should also consider what options are available if a concern does not meet the threshold for a Section 42 enquiry.<br>4)  Systems for making other involved agencies aware of safeguarding referrals and concerns.<br>5)  In relation to each of the above points, whether RBC should reflect the above changes in formal (written) policy, as well as delivering training.<br>6)  Improving interaction amongst agencies involved, and consideration of the threshold for arranging joint meetings to discuss service users, whether they meet Section 42 thresholds or not. The evidence we heard is that this is now being actively encouraged. Should there be written guidance about this somewhat subjective issue ?<br>7)  Whether they consider that the resourcing of this service is adequate and safe.<br>8)  Systems for auditing, and what will happen if the auditing reveals ongoing issues.<br> <br><strong>Berkshire Health Care</strong><br>1)  How do the changes/proposed changes to systems (including the ‘One Team’ approach) make a difference? Specifically:<br>a)  Is the trust able to say with any confidence that a patient like Lucy would not be discharged from the crisis team without additional support, as she was on 2nd February?<br>b)  Is the trust able to say with any confidence that a patient like Lucy would be offered some support, whether by the crisis team or otherwise, in the situation that arose on the 15th February?<br> <br>2) Do they consider that resourcing of these services is adequate and safe?</td>",Coroner name: Heidi Connor,Ref: 2023-0206,"This report is being sent to: Reading Borough Council, Berkshire Healthcare NHS Foundation Trust"
"<td class=""govuk-table__cell""><strong>CORONER’S CONCERNS</strong><br>The <strong>MATTERS OF CONCERN </strong>are as follows: <br> <br>At the inquest I was referred to the National Confidential Enquiry into Suicides. I was informed that the Enquiry identified key factors that should be adopted by Health Organisations to reduce the incidence of suicides, including:<br> <br>•       That there should be a strategy for engagement with the family.<br>•       That every patient should have access to 24-hour Crisis Support Neither of these key components of care were available to Kaye.<br>Whilst I was informed that there were steps being taken to address these I was not persuaded that these guidelines had been fully inculcated into policy<br>and practice at Aneurin Bevan University Health Board.</td>",Coroner name: Caroline Saunders,Ref: 2023-0221,This report is being sent to: Aneurin Bevan University Health Board
"<td class=""govuk-table__cell""><strong><u>CORONER’S CONCERNS</u></strong><br>During the course of the inquest the evidence revealed matters giving rise to concern. In my opinion there is a risk that future deaths will occur unless action is taken. In the circumstances it is my statutory duty to report to you.<br><em> </em><br>The Trust has conducted a PSIR the contents of which were reviewed at inquest. The report reached conclusions I found entirely reasonable. I also heard from [REDACTED] about the steps that are being taken to implement the changes felt to be appropriate. This includes a change to the consultant model with one consultant now responsible for the individual wards. There is also an initiative to standardise documentation, for example, at handover, and later MDT (when risks are reviewed), to ensure this is incorporated into RiO, together with an express intention to involve the family in decision-making. It was accepted that risk should be assessed by a nurse prior to granting leave to an informal patient particularly where unescorted leave is being considered for the first time.<br><em> </em><br>Although Chris’s death occurred in February 2022, it also became clear that the process had not been completed. It was hoped this could be achieved by the end of July this year but the inquest was told there would need to be consideration of the proposals by the different consultants now involved. I was concerned to ensure that the process was completed without undue delay and it is with this in mind that I now write to you.</td>",Coroner name: Andrew Cox,Ref: 2023-0204,This report is being sent to: CPFT
"<td class=""govuk-table__cell""><strong>CORONER’S CONCERNS</strong><br>During the course of the inquest, the evidence revealed matters giving rise to concern. In my opinion, there is a risk that future deaths will occur unless action is taken. In the circumstances, it is my statutory duty to report to you.<br><strong> </strong><br>The <strong>MATTERS OF CONCERN </strong>are as follows.<br><strong> </strong><br>1. I was shocked when I listened to the recording of the call that [REDACTED] made to the crisis line the day before his daughter died.<br><strong> </strong><br>The East London NHS Foundation Trust (ELFT) serious incident (SI) report observed that the clinician did not elicit clear risks during the conversation; did not listen to [REDACTED] ; talked over him; did not appear empathic; and dismissed his distress about his daughter, even though she was a patient known to services after a first episode of psychosis.<br><strong> </strong><br>In reaching my conclusion at inquest that the call was not treated with the seriousness it deserved, I agreed with all of those observations. [REDACTED] was not taken seriously, he was not treated respectfully and he was not treated kindly. He was clearly desperate about his daughter’s mental health and, as we now know, he was right to be desperate. He rang the crisis line and he was belittled.<br><strong> </strong><br>The clinician then made no note of the call in the medical records, even retrospectively.<br><strong> </strong><br>I note the many recommendations of the thoughtful SI report, but I remain concerned on three counts.<br><strong> </strong><br>· This is not the first time that I have made a PFD report to ELFT about its crisis line.<br><strong> </strong><br>· Not only did the clinician in question not make a note of the call in the medical record, he told me in court that, after Freeda Glausiusz’s death his manager had told him not to make an appropriately dated retrospective note in the record. He said that he had made a note on a piece of paper, but he did not now have that piece of paper.<br><strong> </strong><br>When I asked the lead SI reviewer if the trust is confident that it has taken all appropriate actions in respect of that clinician, she was not able to give me that assurance.<br><br>2. I heard at inquest that the clinician and his manager had listened to the recording of the call within days of the death and had recognised very significant shortcomings. However, the recording was not then volunteered to my coroner’s officer. I was aware of the existence of the call only because [REDACTED] told my officer about it.<br><strong> </strong><br>· I received a copy of the recording of the call (without a transcript) the day before the inquest.<br><strong> </strong><br>· I received a statement from the clinician who took the call the day before the inquest.<br><strong> </strong><br>· I received statements from other ELFT clinicians in dribs and drabs earlier this month.<br><strong> </strong><br>· I received a copy of the SI report the day before the inquest.<br><strong> </strong><br>· I never received a copy of the 48 hour hot de-brief.<br><strong> </strong><br>· Freeda Glausiusz died five months ago. My officer first requested witness statements and a copy of any internal investigation on 7 June, over four months ago, and asked for the statements to be provided by 20 August.<br><strong> </strong><br>This chronology does not demonstrate an eagerness to promote a learning culture by ELFT. The failure to provide prompt and candid co-operation with my office obstructs the coronial inquiry, an inquiry that includes the function of learning from deaths. And it does not demonstrate respect for the family of the deceased.</td>",Coroner name: Mary Hassell,Ref: 2023-0199,This report is being sent to: East London NHS Foundation Trust
"<td class=""govuk-table__cell""><strong>CORONER’S CONCERNS</strong><br>During the investigation, my inquiries revealed matters giving rise to concern. In my opinion there is a risk that future deaths could occur unless action is taken. In the circumstances it is my statutory duty to report to you.<br> <br>The <strong>MATTERS OF CONCERN </strong>are as follows:<br>Patients who attend a Hospital Accident and Emergency Department with mental health difficulties are in most hospitals seen by a Mental Health Liaison team (made up of Consultant Psychiatrists and Mental Health nurses) These staff are not employed by the Acute Hospital Trust but are employed by a local Mental Health Trust (in this particular case it was the Sussex Partnership Foundation Trust).<br> <br>As a result of their employment status the Mental Health Liaison team (who have the best knowledge of the patient having been caring for them) cannot invoke the Doctors or Nurses holding powers under Section 5(2) Mental Health Act (Section 5(4) for nurses). If a patient decides to abscond from the Acute Trust Hospital the Mental Health staff cannot detain/hold the patient. They would have to ask a Doctor within the Acute Hospital to do so. This Doctor may not have any knowledge of the patient and would be unlikely to act immediately in a busy A&amp;E. By that time the patient would have been long gone.<br> <br>Due to this technical issue around the employment status of the Mental Health Team, those suffering with a deteriorating mental health in an acute setting are at risk in these circumstances.</td>",Coroner name: Penelope Schofield,Ref: 2023-0218,This report is being sent to: NHS England and Integrated Health Board NHS Sussex
"<td class=""govuk-table__cell""><strong>CORONER’S CONCERNS</strong><br>During the course of the inquest the evidence revealed matters giving rise to concern. In my opinion there is a risk that future deaths will occur unless action is taken. In the circumstances it is my statutory duty to report to you.<br><br>The <strong>MATTERS OF CONCERN </strong>are as follows.  <br>(1)  The patient appears to have been held in ED for 40+ hours during which time footwear was not removed. Necrotic Toe apparent without evidence of appropriate management or referral.<br> <br>(2)   Skin inspection on admission confirmed that all areas were intact but there is no evidence of preventative care despite patients’ time on ED (40 hours) and in AMU (5 days) . Acknowledgement of pressure area damage occurred on the 8th February but no reassessment took place until the 20th February with consequent failure to implement pressure relieving measures.<br> <br>The Pressure Sore acquired in Hospital contributed to the death and it is noted that pressure area care training is not mandatory within Wye Valley Trust.</td>",Coroner name: Hugh Bricknell,Ref: 2023-0223,This report is being sent to: Wye Valley NHS Trust
"<td class=""govuk-table__cell""><strong>CORONER’S CONCERNS</strong><br>During the course of the inquest the evidence revealed matters giving rise to concern. In my opinion there is a risk that future deaths will occur unless action is taken . In the circumstances it is my statutory duty to report to you .<br> <br>The <strong>MATTERS OF CONCERN </strong>are as follows. <br> <br>(1)    A prevention duty was owed to the decease d and due to Herefordshire Council communication process failure, contact was not made with him or those with whom he had approved contact prior to his death.<br> <br>(2)    Evidence suggests that in reality Mr Taylor would have met the threshold for vulnerability set out in the Housing Act 1996 but the failure to progress the application resulted in this never being established.<br><br>(3) A system for identifying process failure should be in place and effective.</td>",Coroner name: Hugh Bricknell,Ref: 2023-0224,This report is being sent to: Herefordshire Council
"<td class=""govuk-table__cell""><strong><u>CORONER’S CONCERNS</u></strong> <br>The evidence I have gathered to date reveals matters giving rise to concern. In my opinion there is a risk that future deaths could occur unless action is taken. In the circumstances it is my statutory duty to report to you. <strong> </strong> <br><br>The <strong>MATTERS OF CONCERN </strong>are as follows :<br>1.     Kai Cheng Barnaby, Deceased, whose death is being investigated by HM Senior Coroner for Inner South London, jumped to his death on the 6th April 2023 from the roof. <br><br>2.     Eight weeks later, on the 1st June 2023, Arezou Tirgari was also able to jump to her death from the same location.<br><br>3.     It seems that no or no sufficient action has been taken to prevent persons being able to jump from the roof terrace and that there is an ongoing risk of further deaths.</td>",Coroner name: Alison Hewitt,Ref: 2023-0226,This report is being sent to: Landsec
"<td class=""govuk-table__cell""><strong><u>CORONER’S CONCERNS</u></strong><br>During the course of the inquest, the evidence revealed matters giving rise to concern.<br><strong> </strong><br>In my opinion there is a risk that future deaths will occur unless action is taken. In the circumstances it is my statutory duty to report to you.<br><strong> </strong><br>The <strong>MATTERS OF CONCERN </strong>are as follows. <br>1.      a. During the Inquest evidence was heard that Eifion’s GP had made a ‘very<br>urgent’ referral to the Single Point of Access and Allocation within BCUHB on 13 May 2022 indicating that on the background of attempts at ending his life, he was extremely concerned that Eifion was experiencing deterioration in his mental state. This document was contained within the hard copy set of notes held by the Psychiatric Liaison Team. When Eifion attended at the Emergency Department the following day, on 14 May 2022, the Emergency department staff were not aware of this ‘very urgent’ referral as they only had access to the electronic notes and not the hard copy notes. Had they been aware it is likely to have further informed their decision making. It is concerning that the process of ensuring electronic notes to allow for fully informed decisions around treatment and care based on all available records, is not available to staff. It was not clear at Inquest whether the transition from paper-based notes to electronic notes was a Health Board initiative or a nationally followed initiative. Either way, any delay in ensuring all notes are available electronically is potentially harmful to patients.<br><strong> </strong><br>b. During the evidence it was accepted that ‘a’ above was not a consideration for improvement as part of the Health Board’s investigation and so was not an action within the Action Plan upon which it could make improvements or plan to make improvements. It is surprising that the Health Board did not consider this as an issue which required further consideration and improvements in its learning and improvement.<br><strong> </strong><br>An investigation was commenced by the Health Board into Eifion’s death which appears to have been concluded in July 2022 but did not appear to be finalised and ready for sharing / disseminating until March 2023. I have previously issued Prevention of Future Death Reports to the Health Board pertaining to the lack of timeliness of their investigations, specifically in relation to investigations from deaths in 2020 and 2021. Whilst I have previously been advised of improvements into investigation processes in respect of more recent deaths the issue of timeliness remains. Eifion died in 2022 and yet the time it took for the investigation to be completed and shared, with actions undertaken has been too long. I am concerned that deaths will occur when the actions arising are not acted upon in a timely manner.</td>",Coroner name: Kate Sutherland,Ref: 2023-0185,This report is being sent to: Betsi Cadwaladr University Local Health Board
"<td class=""govuk-table__cell""><strong>CORONER’S CONCERNS</strong><br>During the course of the inquest the evidence revealed matters giving rise to concern. In my opinion there is a risk that future deaths will occur unless action is taken. In the circumstances it is my statutory duty to report to you.<br><br>The MATTERS OF CONCERN are as follows. [BRIEF SUMMARY OF MATTERS OF CONCERN]<br>(1) Brenda was discharged without any planned follow up. Her family were not involved in the discharge process despite assurances that they would be, her GP did not receive discharge notification from the Hadrian unit until 8 days after the event or from the Crisis team until 10 days after Brenda’s death. Referrals promised from Hadrian unit to Drug/Alcohol services and Persistent Physical Symptoms Service were not made.<br><br>(2) Inadequate weight seems to have been given to Brenda’s alcohol problems and her assurances that all was, and would continue to be well were accepted at face value despite her recent history, her family find it hard to understand how she could be graded low risk on the day she died.<br><br>(3) I refer you to the PFD report I issued referring to Charlotte Grace on 29/10/19. Assurances were given in response to that report which again focused on discharge without family/carer involvement which is surely paramount. I note actions mentioned in the incident report in this case but am still concerned that similar events may occur in future.</td>",Coroner name: Nicholas Shaw,Ref: 2023-0191,"This report is being sent to: Northumberland, Tyne and Wear NHS Trust"
"<td class=""govuk-table__cell""><strong>CORONER’S CONCERNS</strong>   <br>During the inquest I was referred by Mr Stevenson’s treating urologist to published literature relating to Ciprofloxacin and Quinolone antibiotics and a potential rare link to suicide behaviour in patients, although I found on the balance of probabilities that it remained unclear that he was suffering from this side effect, it remained possible for this to be the case.<br> <br>The <strong>MATTERS OF CONCERN </strong>are as follows:<br>(brief summary of matters of concern)<br> <br>•  I heard evidence to suggest that the prescribing doctor did not reference this side effect at the time of issuing the prescription to Mr Stevenson, since it was not in accord with current advice.<br>•  I also heard evidence to suggest that prescribing doctors may not be fully aware of this rare side effect, and that patient’s suffering from depression may be more vulnerable to it.<br>I am therefore concerned that this potential risk has not been given sufficient emphasis and I would ask you to consider the appropriateness of reviewing the current guidelines as to the dispensation of the drug to patients by clinicians and increasing the awareness of the side effect in order to monitor and mitigate the risks.</td>",Coroner name: Martin Fleming,Ref: 2023-0180,This report is being sent to: Medicines & Healthcare products Regulatory Agency
