coroner_concerns,coroner_name,reff_id,report_sent_to
"<td class=""govuk-table__cell""><strong><u>CORONER’S CONCERNS</u></strong> <br>During the course of the inquest the evidence revealed matters giving rise to concern. In my opinion there is a risk that future deaths will occur unless action is taken. In the circumstances it is my statutory duty to report to you.<br> <br>The <strong>MATTERS OF CONCERN </strong>are as follows. –<br>1.  A multitude of factors contributed to Mr. Singh’s death across the custodial and healthcare teams within HMP Birmingham. Many steps have been taken by all organisations with responsibility for Mr. Singh’s safety and health during his time at HMP Birmingham to rectify failings that have been identified such as the consistent failure to use interpreters, poor communication and record keeping within and between teams, the absence of meaningful engagement with Mr. Singh’s family, insufficient consideration of family concerns and failings in the use of the ACCT system.<br><br>2. Much of the evidence at the inquest focused on the central issue of repeated missed opportunities to identify that Mr. Singh required admission to the prison’s inpatient ward, ward 2, and assessment for section 48 transfer to a medium secure unit (which would have been likely to result in transfer to a medium secure unit). The consequences of the failure to transfer Mr. Singh to an inpatient setting were compounded by the fact that he was not taken onto the mental health team’s caseload promptly and therefore did not have the benefit of an allocated CPN and the oversight and input of a mental health multi-disciplinary team. Many steps have been undertaken by Birmingham and Solihull Mental Health Trust (who provide mental health services within the prison) to minimise the risk of such a situation occurring again.<br><br>3. However, there are two features of the mental health care provided to Mr. Singh that create a risk to the lives of others that have not yet been rectified:<br>i.  the fact that the mental health team multi-disciplinary team (MDT) does not include a psychiatrist; and<br>ii. the absence of any ongoing risk assessment documentation for patients with mental illness within the SystemOne records at HMP Birmingham.<br><br>4.  In Mr. Singh’s case it is my conclusion that it is likely that if a psychiatrist had been at a mental health MDT meeting held on the 19th January 2022 they would have identified that he needed to be admitted to ward 2 without further delay. At the very least the need for urgent review by a psychiatrist and CPN would have been recognised and facilitated which would in turn have led to admission. CPNs in Mr. Singh’s case continually failed to identify the significance of repeatedly and consistently reported psychotic symptoms and consequently he did not receive adequate assessment and treatment which increased his risk of self harm and suicide which in turn was not sufficiently identified. The absence of a psychiatrist at the MDT creates a risk that the significance of some symptoms and presentations will not be recognised and further deaths could occur due to lack of appropriate assessment and treatment.<br><br>5. Other electronic health care records systems used in mental health settings have a rolling risk assessment document that clinicians are required to review and update at certain points in a patient’s management. The risk assessment document provides a prompt to clinicians to formally consider risk and come to a reasoned, documented conclusion that then feeds into decision making. The record also provides a reliable, easily accessible source of risk history. No such facility is in use on SystemOne at HMP Birmingham. Further, the evidence given was that such a system is not being used routinely across mental health care within the prison estate and is not provided as standard on SystemOne. This creates an ongoing risk to life arising from under-estimation of risk as a result of clinicians not formally considering and assessing current risk levels, and salient risk history not being easily accessible. It is understood by Birmingham and Solihull Mental Health Trust that it should be possible to create a specific risk assessment record within SystemOne and this is being considered locally. However, the evidence given was that this issue should be highlighted nationally and that the developers and distributors of SystemOne should be involved so as to ensure the best available solution is identified.</td>",,,
"<td class=""govuk-table__cell""><strong>MATTERS OF CONCERN </strong><br>1.     That SPA contacts are not routinely discussed with a supervlsing clinician, ss should have but did not happen in Ms Norman’s case, where mental health symptoms and especially where suicidality is raised by the caller.<br><strong> </strong><br>2.     That such calls are not routinely passed on to a suitably qualified cliniclan able to undertake mental health assessment and assess risk for the patient<br><strong> </strong><br>3.     That SPA contacts are not routinely notified to the patient’s GP and any mental health services providing care for the patient.</td>",,,
"<td class=""govuk-table__cell""><strong><u>CORONER’S CONCERNS</u></strong> <strong> </strong> <br>During the course of the Pre-Inquest hearing , the evidence revealed matters giving rise to concerns. <strong> </strong> In my opinion there is a risk that future deaths will occur unless action is taken. In the circumstances it is my statutory duty to report to you. <strong> </strong> <br><br>The <strong>MATTERS OF CONCERN </strong>are as follows. <br>The Health Board undertook an investigation following Ben’s death. The investigation contains an Action Plan arising as a result of the learning. It has taken the Health Board a considerable amount of time to update and provide the Action Plan, the most recent version still containing outstanding actions and yet Ben died over 2 years ago.<br><strong> </strong><br>It is particularly concerning that learning and actions arising therefrom are not more quickly addressed. If the learning, actions and changes are taking so long then there is a risk that deaths will continue in the interim.<br><strong> </strong><br>Overall, there is an evident lack of overall strategic direction to investigations and learning.</td>",,,
"<td class=""govuk-table__cell""> <strong><u>CORONER’S CONCERNS</u></strong>   <br>During the course of the inquest the evidence revealed matters giving rise to concern. In my opinion there is a risk that future deaths will occur unless action is taken. In the circumstances it is my statutory duty to report to you.   <br><br>The <strong>MATTERS OF CONCERN </strong>are as follows.     <br>The Trust had a shortfall of nursing staff in the Dover and Deal area at the time that Benjamin Hart was under the community mental health team such that although 16 nurses were required to run the service, the Trust only had 8 nurses employed at the time, 2 of whom were long term sick. This left a working complement of 6 nurses to cover the whole area, which required them to take on additional duties. There was no resilience within the team and therefore when the relationship between Ben and his care coordinator broke down there was no capacity within the team to allocate him another care coordinator.<br><br>Although the Trust has regrouped, reorganised and there has been some limited recruitment the shortfall endures; the evidence given at the inquest being that this is a national issue but it is<br>particularly difficult to recruit within this area of Kent</td>",Coroner name: Patricia Harding,Ref: 2023-0113,This report is being sent to: NHS Kent and Medway Integrated Care Board and Kent & Medway NHS & Social Care Partnership Trust
"<td class=""govuk-table__cell""><strong><u>CORONER’S CONCERNS</u></strong> <strong> </strong> <br>During the course of the Inquest the evidence revealed matters giving rise to concern. In my opinion there is a risk that future deaths could occur unless action is taken. In the circumstances it is my statutory duty to report to you.<br><br><strong>The <strong>MATTERS OF CONCERN </strong>are as follows. –<br></strong>The Inquest heard evidence from the Head of Service for Safeguarding and Learning for Stockport Metropolitan Borough Council. She highlighted a long-standing gap in provision, which was described as extending across most if not all local authorities, for vulnerable adults who have complex needs, but who do not fall into the existing framework of social services, Care Act provision or formal mental health supervision. The effect of that gap is that there is no identifiable individual who is a single point of contact in such cases equivalent to a social worker or care coordinator. The result is that many vulnerable adults with complex needs have no such arrangements in place for contact, collating and sharing of information and deployment of services and assistance, support or safeguarding. Where such arrangements are in place, they are necessarily ad hoc in nature in differing frameworks, levels and standards, and can devolve by default to an individual who, whilst well-motivated, may lack the skills and training to properly perform the function, particularly when the vulnerable adult may be in crisis<strong>.</strong></td>",,,
"<td class=""govuk-table__cell""><strong><u>CORONER’S CONCERNS</u></strong> <strong> </strong> <br>During the course of the inquest the evidence revealed matters giving rise to concern. In my opinion there is a risk that future deaths will occur unless action is taken. In the circumstances it is my statutory duty to report to you. <strong> </strong> <br><br>The <strong>MATTERS OF CONCERN </strong>are as follows.  <br>1. Delayed progress of the Autism Strategy work across the Trust. I ask that the Nottingham and Nottinghamshire Integrated Care Board provide a joint response with the Trust to address this concern, as I accept progress with the Autism work will depend upon resources and the agreed Commissioning of specific services<br>2.      Insufficient progress with Complex case management<br>3.      The Serious Incident Investigation process<br><br>I am not reassured that necessary actions to address these serious issues identified are in place.</td>",Coroner name: Elizabeth Didcock,Ref: 2023-0116,This report is being sent to: Nottinghamshire Healthcare NHS Foundation Trust and Nottinghamshire Integrated Care Board
"<td class=""govuk-table__cell""><strong>CORONER’S CONCERNS</strong><br>During the course of the inquest, the evidence revealed matters giving rise to concern. In my opinion, there is a risk that future deaths will occur unless action is taken. In the circumstances, it is my statutory duty to report to you.<br><strong> </strong><br>The <strong>MATTERS OF CONCERN </strong>are as follows.<br>Before he was employed as a proof assistant testing new guns, Mr Roberts’ prospective employer asked for a DBS (Disclosure and Barring Service) certificate. This was provided and recorded no convictions, cautions, reprimands or warnings.<br><strong> </strong><br>However, Mr Roberts had in the past been convicted of a violent offence for which he had received a custodial sentence. This was the reason for his dismissal from his former occupation as a police officer in the MPS (Metropolitan Police Service).<br><strong> </strong><br>If Mr Roberts’ DBS certificate had correctly recorded his conviction, he would not have been employed at Proof House where he had access to firearms.<br><strong> </strong><br>It is unclear to me whether the inaccuracy of the DBS certificate was caused by an error made by the DBS or by the MPS.</td>",,,
"<td class=""govuk-table__cell""><strong><u>CORONER’S CONCERNS</u></strong><br>The <strong>MATTERS OF CONCERN </strong>are, as follows: –<br>1. The recording of information, particularly that conveyed by telephone, was not as comprehensive as it ought to have been. For example, a record of an altercation had not been made.<br>2. Comprehensive planning for home leave and discharge from hospital was not evident, including contingency planning and the involvement of the family.<br><br>Overall situational awareness about Daniel was not evident, including the reconciliation of conflicting accounts about him.</td>",,,
"<td class=""govuk-table__cell""><strong>CORONERS CONCERNS</strong><br>During the course of the inquest the evidence revealed matters giving rise to concern. In my opinion there is a risk that future deaths will occur unless action is taken. In the circumstances it is my statutory duty to report to you.<br><br>The MATTERS OF CONCERN in relation to on-line prescribing are as follows:<br>(1)   Whilst each individual pharmacy had in-house safety checks to safeguard against over­ prescribing by their own pharmacy, there is no integrated system in place which would alert a prescriber to prescriptions that have been dispensed by other on-line pharmacies. As a result, it is currently possible for a patient to obtain excessive quantities of medication by simply placing multiple orders with different on-line pharmacists.<br> <br>(2)   There is no requirement for the on-line pharmacies to share information with the patient’s GP. This means that, in the absence of the patient’s consent to share information, the online prescriber is reliant on the accuracy and truthfulness of the history provided by the patient.<br> <br>(3)   Lack of information sharing also creates a risk that a GP or Pharmacist Prescriber may unwittingly prescribe a medication that is contraindicated with a medication that has been dispensed through an on-line pharmacy.<br> <br>The MATTERS OF CONCERN in relation to the provision of mental health care on Griffin Ward are as follows: <br>(1)  The Recovery &amp; Discharge Plans contained inaccurate information regarding Ania’s consent to share information with her mother. The evidence was that this was an entry made in error in June 2020 and was not picked up by any of the nurses who updated the Recovery &amp; Discharge Plan over the subsequent 11 months.<br> <br>(2)   The Recovery &amp; Discharge Plans did not address the risks associated with Ania’s procurement of Propranolol from on-line pharmacies. The evidence was that an update of the Recovery &amp; Discharge Plan involved members of nursing staff simply adding a note that the overdoses had taken place. The Plan did not show that any meaningful thought had been given to addressing the particular <strong>risk </strong>associated with the procurement of on-line medication.<br> <br>(3) Mandatory refresher training on basic aspects of nursing care such as record keeping, searches, care-planning, undertaking pre- and post-leave assessments and confidentiality is not provided to staff. <br><br>(4) There is no requirement for the outcome of negative personal searches to be documented in the records and consequently there is no ability to effectively audit whether searches are taking place and the treating team are unable to assess a patient’s level of compliance with rules around bringing contraband items onto the ward.<br><br>(5) Searches undertaken of Ania’s room following the overdoses on 10 March and 5 June 2021 were ineffective and did not uncover the Propranolol that Ania had been stockpiling.<br><br>(6) Documentation on which 1:5 observations are recorded does not evidence that a check has taken place every 5 minutes. Instead the current documentation, simply requires one signature per hour. There is therefore no mechanism by which observations can be effectively audited.<br><br>(7) There is no requirement to make a separate entry evidencing that a post-leave assessment has been undertaking. The post-leave assessments are currently subsumed within Day Notes and do not clearly state whether an assessment was undertaken, what was discussed and the outcome of the assessment.</td>",,,
"<td class=""govuk-table__cell""><strong>CORONER’S CONCERNS</strong><br>During the course of the inquest the evidence revealed matters giving rise to concern. In my opinion there is a risk that future deaths will occur unless action is taken. In the circumstances it is my statutory duty to report to you.<br> <br>The <strong>MATTERS OF CONCERN </strong>are as follows. <br>(1)  People are being taken into Police custody, some distance from their home address, without having any money or means of communicating with family, or ready access to transport from the custody suite, to their home address.<br><br>(2) It is requested that the position is reviewed as to what arrangements might be made to facilitate the return of people to their home address from the custody suite.</td>",,,
"<td class=""govuk-table__cell""><strong>CORONER’S CONCERNS</strong> <br>During the course of the inquest the evidence revealed matters giving rise to concern. In my opinion there is a risk that future deaths will occur unless action is taken. In the circumstances it is my statutory duty to report to you.<br><br> The MATTER OF CONCERN is as follows:<br><br>The Commission for Human Medicine (CHM) established an lsotretinoin Expert Working Group (IEWG) in response to concerns about psychiatric events. The IEWG considered oral and written evidence over 2020 and 2021. The findings and recommendations of the IEWG were presented in a report to the CHM at the end of 2021 and include a recommendation which relates to prescribing for patients under the age of 18. <strong> </strong><br><br> It is now over a year since the IEWG report was completed and the recommendations have still not been implemented. In that time there have been 45 adverse lsotretinion events reported to the Medicines Healthcare products Regulatory Agency (MHRA) comprising of 81 psychiatric adverse events, one of which was an attempted suicide. The Court heard that a second working group is required to consider how to implement the IEWG recommendations and that this group has yet to meet.</td>",,,
"<td class=""govuk-table__cell""><strong><u>CORONER’S CONCERNS</u></strong><br>During the course of the inquest the evidence revealed matters giving rise to concern. In my opinion there is a risk that future deaths could occur unless action is taken. In the circumstances it is my statutory duty to report to you.<br><br>The <strong>MATTERS OF CONCERN </strong>are as follows. <br>1. During the course of the inquest reference was made to the National Institute for Clinical Excellence (NICE) guidance “Autistic Spectrum disorder in under 19s: support and management.” Published on 28 August 2013 and in particular paragraph 1.1.4 which states that “<em>Local autism teams should ensure that every child or young person diagnosed with autism has a case manager or key worker to manage and coordinate treatment, care, support and transition to adult care in line with the NICE guideline on autism in children and young people (covering identification and diagnosis).</em>” Stefan did not have a case manager or key worker.<br><br>2. I am unable to say if the lack of a case manager or key worker caused or contributed more than minimally to Stefan’s death but had one been available they may have been able to assist Stefan and his family to navigate the services available which in turn may have led to intervention which may have made a difference. I am prohibited from returning a conclusion which comments on issues where there is no clear causal link with the death however the Coroner’s and<br>Justice Act 2009 creates a duty on Coroners to report an issue which gives rise to a concern which may lead to future deaths.<br><strong> </strong><br>3. I asked for further evidence on the provision of case managers/key workers in accordance with the NICE guidance after the inquest from North East London Foundation Trust and from Kent and Medway Integrated Care Board. It is clear from the evidence provided that such a service is only provided to those under 19 year olds who have both a learning disability and/or a diagnosis of autism and are at risk of admission to a mental health hospital or where there is a significant sudden deterioration in the community and the multi disciplinary team has not been responsive. The lowest level of service outlined in reply to the court indicated that referrals could be made to a key worker to sign post families not that they would have a key worker allocated to them. This sets the bar at a level which means a large number of young people with a learning disability and/or autism would not have a key worker nor would they be expected to have one.<br><br>4. In the evidence provided it was outlined that <em>“Keyworkers will make sure that these children, young people and families get the right support at the right time. They will make sure that local systems are responsive to fully meeting the young people’s needs in a joined-up way and that whenever it is possible to provide care and treatment in the community with the right support this becomes the norm.” </em>If every autistic child or young person had a key worker this would enable them or their family the opportunity to liaise with their key worker rather than having to try to navigate services themselves. This, in turn, may prevent others from encountering the issues faced by Stefan’s family and ultimately prevent future deaths.</td>",,,
"<td class=""govuk-table__cell""><strong><u>CORONER’S CONCERNS</u></strong><br>During the course of the inquest the evidence revealed matters giving rise to concern. In my opinion there is a risk that future deaths will occur unless action is taken. In the circumstances it is my statutory duty to report to you.<br> <br>The <strong>MATTERS OF CONCERN </strong>are as follows. <br>(1)    Continued staffing pressures within Primary Mental Health Services resulting in assessment delays and waiting lists for support e.g the waiting list for LPMHSS counselling remains at 4 – 6 months. There was no evidence that the waiting list would improve moving forward<br> <br>(2)    Whilst awaiting counselling, the only interim support available to patients that are assessed as mild or low risk, are services that come with a requirement to self-refer, despite lack of motivation being a common symptom. The LPMHSS does not have a standardised process for referring low risk patients for interim support and no interim contact or monitoring is offered or arranged (unless patients have self-referred to an organisation providing such services).</td>",,,
"<td class=""govuk-table__cell""><strong>CORONER’S CONCERNS</strong><br>During the course of the investigation my inquiries revealed matters giving rise to concern. In my opinion there is a risk that future deaths could occur unless action is taken. In the circumstances it is my statutory duty to report to you.<br><strong> </strong><br>The <strong>MATTERS OF CONCERN </strong>are as follows:<br>Evidence was heard from police officers from both the Metropolitan Police and Suffolk Constabulary.<br><br>The officers provided evidence of the details they respectively held regarding the missing person investigation surrounding Anthony’s disappearance from London and subsequent death.<br><br>It was clear that crucial information (that Anthony had a rope in his possession, and a collapsible bicycle providing a secondary form of transport) was not passed between the Metropolitan Police and Suffolk Constabulary.<br><strong> </strong><br>It was heard that there was no set format, or prescribed information requirements to be shared by officers reporting missing persons between one force and another. Investigating officers in the Metropolitan police spoke to the Suffolk Constabulary control room, whose staff logged what they were told onto the CAD record. This information was then relayed to the officers on the ground.<br><strong> </strong><br>Witnesses in this case stated that there is no standardised information sharing requirement or protocol for cross border missing persons investigations (including missing persons with suicidal ideation).<br><strong> </strong><br>I am concerned that, as there is no standardised information sharing requirements or protocols in such cases, in the future a force receiving details of a suicidal missing person may also not be informed that an individual has taken a means of suicide with them. In addition, other important information that may assist in the search for that person may also not be passed.</td>",,,
