kamar_mandi;kamar_tidur;Bangunan;Lahan (m≤);harga;lokasi;title;;;;
;1;43;43;Rp 799.000.000;Jagakarsa Jakarta Selatan;Jual Cepat Kios Pinggir Jalan Raya Kebagusan;;;;
;2;50;40;Rp 570.000.000;Cilodong Depok;Rumah.CILODONG 2 lantai Minimalis Cilodong Depok;;;;
;5;400;117;Rp 6.500.000.000;Pluit Jakarta Utara;Rumah Dijual Pluit Sakti. Langka. Full Furnish. Siap Huni. Bagus.; dkt taman; tol; dll.;
;1;40;69;Rp 520.000.000;Buahbatu (Margacinta) Bandung;RUMAH MURAH KOTA BANDUNG; Letak Strategis Di Tengah Kota Sukabumi;;;
;4;400;650;Rp 5.000.000.000;Saba Gianyar;Rumah villa Di jual;;;;
;1;100;2430;Rp 1.800.000.000;Lokasi Diwek Jombang. Diwek Jombang;Jual Cepat Rumah dan Tanah DI Jombang;;;;
;2;55;32;Rp 500.000.000;Wonokromo Surabaya;Rumah Murah 2 Lantai Wonorejo Selatan Rungkut MERR Surabaya;;;;
;1;36;72;Rp 398.000.000;Cileungsi Bogor;Rumah Cluster Siap Huni; dijual cepat rumah dengan luas 300m2;;;
;1;75;100;Rp 980.000.000;Tanah Lot Tabanan;Di Jual Villa Daerah Tanah Lot 2KT dan Privat Kolam Renang;;;;
;1;37;72;Rp 375.000.000;Serang Baru Bekasi;Rumah murah Cempaka Jayasampurna Cikarang;;;;
;2;;;Rp 457.400.000;Jl. Raya Cikarang - Cibarusah Sukadami Cikarang Selatan Bekasi;Tipe New Derby - Cifest;;;;
;2;;;Rp 674.750.000;Jl. Raya Cikarang - Cibarusah Sukadami Cikarang Selatan Bekasi;Tipe Magnolia - Cifest;;;;
;2;;;Rp 500.000.000;Jalan Raya Metland Cibitung Wanajaya Cibitung Bekasi;Metland Cibitung Cluster Spring Terrace Tipe 38;;;;
;2;;;Rp 410.250.000;Jl. Raya Cikarang - Cibarusah Sukadami Cikarang Selatan Bekasi;Tipe New Aspen - Cifest;tol jatinegara;rs jayakarta;;
;2;;;Rp 525.000.000;Jl. Olah Raga Loji Jatiwangi Majalengka;Dar es Salaam Residence Tipe 54;;;;
;2;;;Rp 531.000.000;Jl. Bantar Gebang Setu No.51 Cimuning Mustika Jaya Bekasi;Tipe Boston (Timur) - Mutiara Columbus;;;;
;2;;;Rp 381.000.000;Jl. Bantar Gebang Setu No.51 Cimuning Mustika Jaya Bekasi;Tipe New Derby - Mutiara Columbus;;;;
;1;;;Rp 495.000.000;Jalan Raya Metland Cibitung Wanajaya Cibitung Bekasi;Metland Cibitung Cluster Spring Terrace Tipe 27;;;;
;3;;;Rp 877.710.500;Jalan Raya Metland Cibitung Wanajaya Cibitung Bekasi;Metland Cibitung Cluster Alamanda Tipe Mandeville;;;;
;1;;;Rp 366.550.000;Jl. Raya Cikarang - Cibarusah Sukadami Cikarang Selatan Bekasi;Tipe Mahogani - Cifest;7M 3 Lantai; 5 menit dari tol Pamulang Serpong;;
;2;;;Rp 540.800.000;Jalan Raya Manyar Sembayat Betoyoguci Betoyokauman Manyar Gresik;Cluster Garnet Place Tipe Millenial Home ‚Äì AKR GEM City;persahabatan;tol rawamangun shm;;
;3;;;Rp 1.622.000.000;Jl. Puspitek Raya Babakan Setu Tangerang Selatan;Paradise Serpong City Tipe Grayson;;;;
;3;;;Rp 1.500.000.000;Esplanade Ave Lambangjaya Tambun Selatan Bekasi;Grand Wisata Tanamas Tipe 6;;;;
;1;;;Rp 333.200.000;Jl. Raya Cikarang - Cibarusah Sukadami Cikarang Selatan Bekasi;Tipe Aspen - Cifest;;;;
;2;;;Rp 564.350.000;Jl. Raya Cikarang - Cibarusah Sukadami Cikarang Selatan Bekasi;Tipe Boston - Cifest; harga teranglah;;;
;2;;;Rp 1.141.000.000;Jl. Puspitek Raya Babakan Setu Tangerang Selatan;Paradise Serpong City Tipe Arstone;;;;
;3;;;Rp 1.640.000.000;Jalan Hang Lekiu Nongsa Batam;The Nove Tipe Terrace House ‚Äì Nuvasa Bay; 5KT;3KM; 1 Carport; 5teras)
;2;;;Rp 739.150.000;Jl. Raya Cikarang - Cibarusah Sukadami Cikarang Selatan Bekasi;Tipe Birmingham - Cifest; Harga Murah Mewah; Bonus Kolam Renang;;
;3;;;Rp 1.502.957.500;Jalan Alternatif GOR Pemda Cibinong Bogor;The Anggana Village Tipe 95;;;;
;2;;;Rp 885.205.000;Jalan Alternatif GOR Pemda Cibinong Bogor;The Anggana Village Tipe 45;;;;
;3;;;Rp 650.000.000;Jl. Olah Raga Loji Jatiwangi Majalengka;Dar es Salaam Residence Tipe 69;;;;
;1;;;Rp 331.000.000;Jl. Bantar Gebang Setu No.51 Cimuning Mustika Jaya Bekasi;Tipe Derby - Mutiara Columbus;;;;
;3;;;Rp 1.610.000.000;Jl. Brigjend. H. Saptadji Hadiprawira No. 27 Cilendek Barat Bogor;Anvaya Townhouse Tipe Vasra;;;;
;1;;;Rp 578.604.401;Jalan Raya Metland Cibitung Wanajaya Cibitung Bekasi;Metland Cibitung Cluster Salvia Tipe Lavender;;;;
;2;;;Rp 727.015.200;Jalan Alternatif GOR Pemda Cibinong Bogor;The Anggana Village Tipe 36;;;;
;2;;;Rp 968.162.000;Jalan Alternatif GOR Pemda Cibinong Bogor;The Anggana Village Tipe 54;;;;
;2;;;Rp 565.500.000;Jl. Raya Cikarang - Cibarusah Sukadami Cikarang Selatan Bekasi;Tipe Ebony - Cifest;;;;
;3;;;Rp 2.600.000.000;Jalan Hang Lekiu Nongsa Batam;The Nove Tipe Semi Detached ‚Äì Nuvasa Bay;;;;
;2;;;Rp 535.000.000;Jalan Raya Metland Cibitung Wanajaya Cibitung Bekasi;Metland Cibitung Cluster Spring Terrace Tipe 37;;;;
;3;;;Rp 1.465.002.000;Jl. Brigjend. H. Saptadji Hadiprawira No. 27 Cilendek Barat Bogor;Anvaya Townhouse Tipe Vardhana;;;;
;2;;;Rp 1.347.000.000;Jl. Puspitek Raya Babakan Setu Tangerang Selatan;Paradise Serpong City Tipe Valiant;;;;
;3;;;Rp 1.194.736.200;Jalan Alternatif GOR Pemda Cibinong Bogor;The Anggana Village Tipe 72;;;;
;3;;;Rp 935.000.000;Jl. Bantar Gebang Setu No.51 Cimuning Mustika Jaya Bekasi;Tipe Maple - Mutiara Columbus; MURAH SEKALI;Lokasi Terbaik;;
;3;;;Rp 822.850.000;Jl. Bantar Gebang Setu No.51 Cimuning Mustika Jaya Bekasi;Tipe Manchester - Mutiara Columbus;;;;
;3;;;Rp 1.058.850.000;Jl. Raya Cikarang - Cibarusah Sukadami Cikarang Selatan Bekasi;Tipe Manchester - Cifest;;;;
;2;;;Rp 841.500.000;Jl. Raya Cikarang - Cibarusah Sukadami Cikarang Selatan Bekasi;Tipe Minesotta - Cifest;;;;
;2;;;Rp 674.000.000;Jl. Bantar Gebang Setu No.51 Cimuning Mustika Jaya Bekasi;Tipe Magnolia - Mutiara Columbus; Lokasi Strategis di Pondok Benda Pamulang;;;
;2;;;Rp 732.250.000;Jl. Raya Cikarang - Cibarusah Sukadami Cikarang Selatan Bekasi;Tipe Canelli - Cifest;;;;
;2;;;Rp 627.800.000;Jl. Raya Cikarang - Cibarusah Sukadami Cikarang Selatan Bekasi;Tipe Cambridge - Cifest; Cijago Free Biaya DP Ringan;;;
;2;;;Rp 657.000.000;Jl. Bantar Gebang Setu No.51 Cimuning Mustika Jaya Bekasi;Tipe Montana - Mutiara Columbus;;;;
;3;;;Rp 1.232.500.000;Jl. Raya Cikarang - Cibarusah Sukadami Cikarang Selatan Bekasi;Tipe Washington - Cifest;;;;
;3;;;Rp 1.323.000.000;Pulo Gadung Jakarta Timur;dijual rumah jatinegara lio dekat buaran;;;;
;3;;;Rp 2.093.175.000;Rawamangun Jakarta Timur;dijual rumah cipinang dekat klender;;;;
;4;;;Rp 3.200.000.000;Cluster Pejaten Pasar Minggu Jakarta Selatan Pasar Minggu Jakarta Selatan;Dijual Murah Rumah Cluster Pejaten Pasar Minggu Jakarta Selatan;;;;
;2;;;Rp 1.274.164.000;Cempaka Putih Jakarta Pusat;dijual rumah dekat tol cempaka putih;;;;
;2;;;Rp 550.000.000;Jalan Raya Gas Alam Depok Indonesia Cisalak Depok;Rumah Nempel Tol Cijago dan Cibubur;;;;
;2;;;Rp 968.730.000;Cipinang Muara Jakarta Timur;dijual rumah dekat tol cawang;;;;
;4;;;Rp 2.560.000.000;Jalan Kucica IX Bintaro Tangerang Selatan;Rumah Exclusive di Bintaro Sektor IX; Posisi Di Tengah Kota Sukabumi;;;
;3;;;Rp 1.477.000.000;Rawamangun Jakarta Timur;Rumah minimalis modern shm pemuda rawamangun dekat tol;;;;
;3;;;Rp 1.353.400.000;Klender Jakarta Timur;dijual rumah dekat klender;;;;
;2;;;Rp 796.000.000;Rawamangun Jakarta Timur;dijual rumah pisangan baru dekat tol jatinegara;;;;
;2;;;Rp 750.000.000;Jl. Raya Curug RT. 002 RW.004 sawangan depok Curug Depok;Dijual Rumah Lokasi Sangat Strategis Dekat Tol Sawangan;;;;
;2;;;Rp 1.072.500.000;Senen Jakarta Pusat;djual rumah tanah tinggi semi ruko dekat rscm;;;;
;3;;;Rp 5.900.000.000;Uluwatu Badung;VILLA FAVOR OF GOD;;;;
;3;;;Rp 6.500.000.000;Cinere Depok;TERMURAH RUMAH SIAP HUNI 1 LANTAI KOMPLEK PURI CINERE;;;;
;4;;;Rp 10.500.000.000;RUBY Permata Hijau Jakarta Selatan;RUMAH SIAP HUNI DALAM KOMPLEK PERMATA HIJAU 1 BELAKANG ITC;;;;
;2;;;Rp 285.000.000;Cibinong Bogor;Cluster Murah di Cibinong Bogor;;;;
;2;;;Rp 445.000.000;Jalan Haji Sulaeman Depok 16519 Indonesia Sawangan Depok;Hunian Dengan Model Scandinavian di Sawangan Depok;;;;
;2;;;Rp 619.000.000;Jalan Prabu Kian Santang Tangerang Kota 15132 Indonesia Periuk Tangerang;Duta Indah Residence Rumah Cantik Baru Launching di Kota Tangerang;;;;
;2;;;Rp 600.000.000;Jl. Mutiara Baru Kedung Waringin Kecamatan Bojonggede Kabupaten Bogor Jawa Barat 16923 Bojonggede Bogor;Rumah Dekat Stasiun Bojonggede Bisa jalan kaki Dp 0% Cukup 3 Jt Allin; Rumah Villa Ada Kolam Renang Pribadinya;;;
;2;;;Rp 425.000.000;Nepak Bulurejo Mertoyudan Magelang;Rumah Murah Siap Huni Pakelan Magelang;;;;
;3;;;Rp 2.700.000.000;ingenia eminent bsd city Bumi Serpong Damai Tangerang Selatan;Dijual rumah termurah cluster ingenia eminent bsd tangerang; Buahbatu; Bandung;;
;2;;;Rp 590.000.000;Ciledug Tangerang;Rumah Komplek 2 Lantai Bersih Rapih Siap Huni;;;;
;3;;;Rp 1.150.000.000;Jalan Jatibening Raya Bekasi Kota Indonesia Bintara Jaya Bekasi;Jual rumah baru lokasi jatibening caman akses jatiasih pondok gede;kelapa gading;salemba;kemayoran;
;3;;;Rp 1.200.000.000;Jalan Raya Ir. Juanda Depok Sukmajaya Depok;Rumah diapit 2 Tol Di Depok;;;;
;3;;;Rp 875.000.000;Ungasan Badung;Rumah /Cozy House with Strategic Location in Bali Cliff;;;;
;3;;;Rp 700.000.000;Jalan Raya Tapos Depok 16467 Indonesia Cimanggis Depok;Rumah 2 Lantai di Cimanggis Deket Tol Cimanggis Depok;9 Jt-an;;;
;3;;;Rp 1.200.000.000;Jalan Ir H Djuanda Depok 16418 Indonesia Sukmajaya Depok;Rumah Murah Deket Stasiun UI Depok;;;;
;2;;;Rp 514.680.000;Jl. Raya Pertamina Kedung Jaya Babelan Bekasi Babelan Bekasi;Jual Rumah Bekasi Scandinavian Style Cukup 5-juta All-In;;;;
;2;;;Rp 614.000.000;Jl. Raya Pertamina Kedung Jaya Babelan Bekasi Babelan Bekasi;Perumahan di Bekasi Desain Scandinavian 5-juta All-In; di Villa inti Persada; Pamulang;;
;2;;;Rp 600.000.000;Matraman Jakarta Timur;Rumah Murah 2 Lantai di Pusat Kota Jakarta Timur;;;;
;3;;;Rp 996.200.000;Jalan Raya Bouluvard GDC Depok Jawa Barat Cilodong Depok;Hunian Mewah 2 Lantai Di GDC Termurah;;;;
;2;;;Rp 250.000.000;Rukoh Banda Aceh;Dijual Rumah Dekat Unsyiah dan UIN Ar Raniry Darussalam Banda Aceh;;;;
;2;;;Rp 168.000.000;Jl. Alternatif Cileungsi Jonggol KM.10 Desa Sukamaju Kecamatan Jonggol Kabupaten Bogor 16830 Cileungsi Bogor;Rumah Subsidi Pemerintah Dekat Cibubur Jakarta Puri Asri 3 Cileungsi - Bogor;becakayu;cipinang;rawamangun;bekasi
;2;;;Rp 305.000.000;Menuran Kel. Baki Sukoharjo Indonesia Baki Sukoharjo;Rumah Cluster Ready/ Pesan Bangun di Baki Sukoharjo (IY);;;;
;2;;;Rp 250.000.000;Rukoh Rukoh Banda Aceh;Dijual Perumahan Dekat Kampus Unsyiah dan UIN Darussalam Banda Aceh; wiyung; dkt greenlake; citraland; wbm
;2;;;Rp 159.999.998;Popongan Kec. Banyuurip Kabupaten Purworejo Jawa Tengah Banyu Urip Purworejo;PERUMAHAN MINIMALIS TERMURAH PURWOREJO ANGSURAN 900K/BULAN DP 5% CASA DE VALLEY;;;;
;2;;;Rp 168.000.000;Jln Raya Alternatif Cileungsi Bogor Desa Situsari kecamatan Cileungsi kabupaten Bogor Timur Cileungsi Bogor;KPR Rumah Subsidi Pemerintah Di Cileungsi Bogor Harga Mulai 130 Juta Puri Asri 3;;;;
;3;;;Rp 980.000.000;Bumi Serpong Damai Tangerang Selatan;Rumah Baru Ready Stok BSD Serpong 5min Bintaro Pondok Aren Alam Sutera;;;;
;2;;;Rp 795.000.000;Pamulang Tangerang Selatan;RUMAH BARU 2LT SIAP HUNI DI PAMULANG;;;;
;2;;;Rp 168.000.000;Jl. Raya Kali CBL Sukamekar Kec Babelan Bekasi;Perumahan Subisdi Murah Asri Berlokasi Strategis;busway;unj;;
;3;;;Rp 887.800.000;Jalan Kepu Dalam 10 Jakarta Pusat 10620 Indonesia Kemayoran Jakarta Pusat;DiJual Rumah Mewah Minimalis Modern 2 lantai di Kepu Kemayoran Jakpus;;;;
;9;;;Rp 1.550.000.000;Fastrespon WA : 0813 9127 8889 / 0823 2337 4139 Depok Sleman;Dijual Cepat;;;;
;2;;;Rp 369.998.000;JALAN RAYA TAJUR. citeureup-sentul.BOGOR. GREEN SEMESTA CITY. Sentul Bogor;JANGAN SAMPAI TERLEWATKAN PROMO BERKAH HANYA BOOKING 2JT ALL IN HARGA;;;;
;3;;;Rp 995.000.000;Jalan Palem Puri 1 Bintaro Tangerang Selatan;Cluster 2 Lantai Minimalis Dekat Dengan Stasiun Kereta Bintaro Sektor 9;;;;
;3;;;Rp 1.600.000.000;Jatisari Bekasi;Dijual Rumah Jatisari Jatiasih Bekasi LT 176 SHM. PINGGIR JALAN;;;;
;2;;;Rp 168.500.000;Jalan raya Bojong kelapa Nunggal Desa Situsari kecamatan Cileungsi kabupaten Bogor Cileungsi Bogor;Rumah Subsidi Pemerintah Dekat Cibubur Jakarta Pondok Permata Cileungsi - Bogor;;;;
;2;;;Rp 390.000.000;Mojosongo Mojosongo Solo;Rumah Cluster Murah dan Bagus Mojosongo;;;;
;3;;;Rp 1.390.000.000;Serpong Tangerang Selatan;Rumah Minimalis Modern Serpong Jaya;;;;
;2;;;Rp 150.500.000;Jl. Belimbing Natar Natar Lampung Selatan;Cluster Subsidi Murah Dekat Kota Bandar Lampung TANPA DP;;;;
;4;;;Rp 985.000.000;Taman Widya Asri Tahap Ke-1 Serang Serang;Dijual Rumah Siap Huni Pusat Kota Serang Taman Widya Asri;;;;
;2;;;Rp 300.000.000;Tajur Halang Bogor;Griya Amalia Residence;;;;
;2;;;Rp 150.000.000;Kemiling Bandar Lampung;Subsidi Rumah di Kota Bandar Lampung 2 Kamar Tanpa DP;;;;
;4;;;Rp 896.000.000;Taman Madiun;Rumah Bagus di Lingkungan Nyaman dekat Dengan Jalan Salak Madiun;;;;
;2;;;Rp 457.000.000;Citayam Depok;Dijual Rumah Siap Huni Tanpa DP di Ragajaya Citayam;;;;
;2;;;Rp 796.620.000;Rawamangun Jakarta Timur;dijual rumah pisangan baru dekat tol jatinegara;;;;
;3;;;Rp 890.000.000;Margahayu Bandung;Rumah Baru Lux Minimalis Modern Strategis dekat Metro Indah Mall (MIM);;;;
;2;;;Rp 369.996.000;Jalan raya tajur citeureup-sentul. BOGOR. GREEN SEMESTA CITY. Sentul Bogor;RUMAH DIJUAL TERJANGKAU DIBOGOR HANYA BOOKING 2 JUTA ALL IN;;;;
;2;;;Rp 369.997.000;jalan raya tajur citeureup-sentul bogor. GREEN SEMESTA CITY. Sentul Bogor;DIJUAL RUMAH 2LANTAI HARGA 300JTAN DI BOGOR FREE DP BEBAS BANJIR;;;;
;2;;;Rp 762.260.000;Jalan Pisangan Baru Utara Jakarta Timur 13120 Indonesia Matraman Jakarta Timur;DiJual Rumah Mewah Minimalis Modern 2 lantai di Jl Pisangan Baru Utara;;;;
;5;;;Rp 4.100.000.000;Jalan raya pondok kelapa Pondok Kelapa Jakarta Timur;Rumah Baru Hoek Pondok Kelapa Duren Sawit Jakarta Timur;;;;
;3;;;Rp 1.400.000.000;Ngaglik Sleman;Rumah Pinggir Jalan Damai Kaliurang Palagan Yogyakarta;;;;
3;3;;;Rp 880.000.000;Perumahan Maganda Residence Blok A31 Batam Center Batam;DIJUAL RUMAH BATAM CENTRE LOKASI STRATEGIS;;;;
;2;;;Rp 170.000.000;jalan cik ditiro Kemiling Bandar Lampung;Clutser Subsidi Dalam Kota Bandar Lampung 2 Kamar Siap Huni;;;;
;4;;;Rp 1.500.000.000;Perumahan Galuh Mas Cluster Metropolis Blok IV A No. E 11 Ds. Sukaharja Kec. Teluk Jambe Timur Kab. Karawang Barat Jawa Barat. Telukjambe Timur Karawang;DIJUAL CEPAT PERUMAHAN GALUH MAS CLUSTER METROPOLIS DEKAT DGN TOL KARAWANG BARAT;bekasi;cipinang;10 menit tol rawamangun;
;3;;;Rp 690.000.000;Jalan Kencana Kalimulya Cilodong Depok;Rumah 2 Lantai Cluster Gaya Bali Kalimulya Cilodong Depok;;;;
;5;;;Rp 10.000.000.000;Fastrespon WA : 0813 9127 8889 / 0823 2337 4139 Ngaglik Sleman;Rumah TerMewah Perum Elite Bale Mulia+Private Pool;klender;rawamangun;unj;
;6;;;Rp 1.500.000.000;Tiban Batam;Dijual Cepat Rumah Keluarga di Tiban Maseba Batam;;;;
;3;;;Rp 775.500.000;Jl Y Cipinang Muara Jakarta Timur Cipinang Muara Jakarta Timur;Di Jual Rumah Mewah Minimalis Modern di Cipinang Muara;;;;
;3;;;Rp 650.000.000;Taman Kota Ciperna Blok C3 No. 6 RW. 06 RT. 03 Desa Ciperna Kec. Talun Kab. Cirebon Cirebon Jawa Barat - 45171 Talun (Cirebon Selatan) Cirebon;Dijual rumah dengan cepat di Taman Kota Ciperna Kab. Cirebon;;;;
;3;;;Rp 1.850.000.000;Bedugul Tabanan;VILLA FULL FURNISH DI KAWASAN WISATA BEDUGUL;;;;
;8;;;Rp 15.000.000.000;Ubud Gianyar;villa Gress di ubud;;;;
;6;;;Rp 15.000.000.000;Jalan Radar Auri Perumahan Pondok Cibubur BLOK H4/22. Cisalak Pasar Cimanggis Depok. Cimanggis Depok;Rumah mewah 3 lantai;rspad;tol cemput;atrium;
;8;;;Rp 1.375.000.000;Jalan Imogiri Timur Yogyakarta Indonesia Umbulharjo Yogyakarta;RUMAH KOST EKSKLUSIF 3 LANTAI DI JOGJA GIWANGAN DALAM RINGROAD DEKAT UAD;;;;
;4;;;Rp 980.000.000;Batam Center Batam;Rumah Beverly park (batam center);;;;
;4;;;Rp 4.950.000.000;Cluster Khafi View Residence Jagakarsa Jakarta Selatan Jagakarsa Jakarta Selatan;Dijual Rumah Cluster Khafi View Residence Jagakarsa Jakarta Selatan;;;;
;5;;;Rp 2.960.000.000;Perumahan Bogor view Semplak Bogor;Rumah di jual diBogor barat dng view gn. salak bentuk tanah kantung semar;;;;
;2;;;Rp 290.000.000;Solodiran Prambanan Prambanan Sleman;SEBELUM KEHABISAN RUMAH DIBAWAH 300 JUTA DEKAT CANDI PRAMBANAN;;;;
;8;;;Rp 12.800.000.000;Jalan sayap Ahmad Yani Bandung kota Riau Bandung;Rumah Belanda clasik murah di dekat Ahmad Yani sayap Riau kota Bandung;;;;
;10;;;Rp 11.500.000.000;Fastrespon WA : 0813 9127 8889 / 0823 2337 4139 Depok Sleman;Dijual Cepat Kost Exclusive 41kt+ Caffe dkt Hartono Mall;;;;
;2;;;Rp 150.500.000;Jalan Parakan Salak / Parungkuda-Pakuwon Parungkuda Sukabumi Jawa Barat. Parung Kuda Sukabumi;DIJUAL RUMAH SUBSIDI Perumahan Pusaka Bumi Parungkuda;8Jutaan;;;
;2;;;Rp 355.000.000;Prambanan Sleman;RUMAH MINIMALIS MODERN DEKAT JALAN JOGJA SOLO;;;;
;2;;;Rp 150.000.000;Gedong Tataan Pesawaran;Rumah Subsidi 2 Kamar Dekat Kemiling Bandar Lampung;;;;
;3;;;Rp 3.200.000.000;Jagakarsa Jakarta Selatan;Dijual Rumah Mewah Cluster Pejaten Pasar Minggu Jakarta Selatan;;;;
;3;;;Rp 1.478.200.000;Jalan Cempaka Putih Barat III Jakarta Pusat 10520 Indonesia Cempaka Putih Jakarta Pusat;DiJual Rumah Mewah Minimalis Modern 2 lantai di Cempaka Putih Barat 3;;;;
;4;;;Rp 12.500.000.000;Ubud Gianyar;Villa siap huni di ubud;;;;
;2;;;Rp 968.000.000;Jalan Raya Sawangan Depok Indonesia Sawangan Depok;RUMAH PREMIUM SIAP HUNI DEKAT TOL DESARI DAN STASIUN DEPOK;;;;
;3;;;Rp 1.550.000.000;Pantai Mentari Blok Z - 1A Kenjeran Surabaya;Rumah Baru Gres American Minimalis di Pantai Mentari; cocok untuk ruko;;;
;4;;;Rp 3.900.000.000;Pasar Minggu Jakarta Selatan;Rumah Lux di kalibata pasar minggu Jakarta Selatan;;;;
;4;;;Rp 1.800.000.000;Jalan Kelapa Tiga Jakarta Selatan Indonesia Jagakarsa Jakarta Selatan;CLUSTER MEWAH PINGGIR JALAN UTAMA; Aman Nyaman Dekat Pusat Kota;;;
;5;;;Rp 4.500.000.000;Jalan Paso Jakarta Selatan 12620 Indonesia Jagakarsa Jakarta Selatan;RUMAH MEWAH PRIVATE POOL DALAM CLUSTER;;;;
;2;;;Rp 369.993.000;JALAN RAYA TAJUR CITEUREUP-SENTUL BOGOR. GREEN SEMESTA CITY. Sentul Bogor;DIJUAL RUMAH IMPIAN DILOKASI STRATEGIS BEBAS BANJIR HARGA TERJANGKAU;5; juta;;
;4;;;Rp 1.987.500.000;Jalan T. B. Simatupang Jakarta Selatan 12610 Indonesia Cilandak Timur Jakarta Selatan;RUMAH MEWAH CILANDAK TIMUR;;;;
;5;;;Rp 4.800.000.000;Jalan Paso Jakarta Selatan 12620 Indonesia Jagakarsa Jakarta Selatan;RUMAH MURAH MEWAH REDI SIAP HUNI JAGAKARSA; mushola dll;;;
;2;;;Rp 610.000.000;Jalan Raya Dago Bogor Kabupaten 16369 Indonesia Parung Panjang Bogor;De' Lora Parung Panjang. Hunian baru nuansa resort. Dekat Stasiun;;;;
;2;;;Rp 1.105.720.000;3 Jalan Cipinang Kebembem Jakarta Timur 13230 Indonesia Cipinang Jakarta Timur;DiJual Rumah Mewah Minimalis Modern 2 lantai di Jl Cipinang Kebembem 3;;;;
;6;;;Rp 3.500.000.000;Jalan Tanimbar Dauh Puri Kelod Denpasar;RUMAH BESAR BANGUNAN LAMA DEKAT DIPONEGORO DENPASAR;cuma 20 menitan dr stasiun cikarang;;;
;3;;;Rp 908.050.000;Jl Lio 2 Pulogadung Jakarta Timur Pulo Gadung Jakarta Timur;DiJual Rumah Mewah Minimalis Modern 2 lantai di Jl Lio Pulogadung;;;;
;4;;;Rp 1.014.860.000;Cipinang Jakarta Timur;dijual rumah dekat mal basura;;;;
;3;;;Rp 1.075.000.000;Bolon Colomadu Karanganyar;Rumah Bagus Siap Huni di Colomadu Karanganyar (EL);;;;
;2;;;Rp 790.000.000;Grand Mahkota Blok A3 No 1 Babelan Bekasi;DIJUAL MURAH RUMAH HOOK CLUSTER GRAND MAHKOTA 1;;;;
;5;;;Rp 5.000.000.000;Jalan Haji Ramli Jakarta Selatan 12870 Indonesia Menteng Dalam Jakarta Selatan;Rumah Tebet Cocok Untuk Kantor & Usaha;;;;
;2;;;Rp 790.000.000;Babelan Bekasi;DIJUAL MURAH RUMAH HOOK CLUSTER GRAND MAHKOTA 1 ; cajuputi de park di bsd; kawasan mewah harga nego;;
;2;;;Rp 800.000.000;Jalan Boulevard Gading Serpong Tangerang Selatan 15335 Indonesia Gading Serpong Tangerang;Rumah Minimalis;;;;
;2;;;Rp 168.000.000;Jl. Kedaung Desa Karang Anyar Karangbahagia Bekasi;RUMAH SUBSIDI CIKARANG BEKASI | MADANIA RESIDENCE;;;;
;2;;;Rp 590.000.000;Muara Beres Sukahati Cibinong Bogor;Rumah Tanpa DP Cibinong Bogor;;;;
;5;;;Rp 2.650.000.000;Tegalharjo Jebres Solo;Rumah Bagus 2 Lantai Strategis Dekat Pusat Bisnis di Jebres Surakarta (AB-AD);;;;
;4;;;Rp 3.600.000.000;Jalan Haji Saaba Raya & Jalan Meruya Selatan Jakarta Barat 11650 Indonesia Meruya Selatan Jakarta Barat;Rumah Mewah Siap Huni Konsep Classic Lokasi Strategis di Meruya Jakbar;;;;
;7;;;Rp 3.000.000.000;Fastrespon WA : 0813 9127 8889 / 0823 2337 4139 Ngaglik Sleman;Rumah Cantik istimewa 2lt Condongcatur utara Terminal;;;;
;3;;;Rp 1.900.000.000;Graha Surabaya;Rumah Surabaya Barat Lebar 7 Dian Istana area Graha Famili 5 menit Tol Satelit;;;;
;3;;;Rp 1.890.000.000;Jl. Usaha Cawang Jakarta Timur Cawang Jakarta Timur;Hunian Mewah 3 Lantai Di Cluster Cawang Residence 1 Unit Terakhir SIAP HUNI;;;;
;3;;;Rp 621.000.000;Jatisampurna Bekasi;RUMAH EKSLUSIVE 2 LANTAI DI CLUSTER SILATURAHIM RESIDENCE;;;;
;3;;;Rp 2.200.000.000;Kompleks Perumahan Nirwana Eksekutif Surabaya;*Dijual Rumah Baru Gres Minimalis di Nirwana Eksekutif;;;;
;6;;;Rp 4.700.000.000;Fastrespon WA : 0813 9127 8889 / 0823 2337 4139 Ngaglik Sleman;Dijual Rumah Homestay Mewah + Kolam Renang dkt UGM;;;;
2;3;;;Rp 1.542.000.000;Jl. Jalur Lingkaran Barat Tallasa Boulevard Kel. Parangloe Kec. Tamalanrea Makassar Tamalanrea Makassar;TIPE TERBARU CITRALAND TALLASA CITY MAKASSAR TYPE TUSCANY;;;;
2;3;;;Rp 4.300.000.000;Darmo Surabaya;Jual Cepat Rumah Full Furnish Darmo Baru LT 395;;;;
1;2;;;Rp 400.000.000;Jalan Banjaran Pucung Depok 16466 Indonesia Cilangkap Depok;Rumah 400 jutaan 2 lantai akses Tol cimanggis dan citeureup;;;;
3;4;;;Rp 1.200.000.000;Perumahan Graha Nirwana - Blok D6 (Dekat Puri Gading) Jatiasih Bekasi;Dijual Rumah Nyaman Bebas Banjir Harga bisa Nego - Turun Harga;;;;
1;2;;;Rp 230.000.000;Ciampea Bogor Kabupaten JABODETABEK Indonesia Bogor;Perumahan baru ciampea bogor; angsuran 3 jt'an );;;
1;2;;;Rp 260.000.000;Jalan Raya Mojowuku Gresik 61175 Indonesia Kedamean Gresik;Rumah Mewah angs 600 rban saja & Free semua biaya2;;;;
2;3;;;Rp 950.000.000;Graha Studio Alam Blok A1 No.1 Jatimulya Cilodong Depok Sukmajaya Depok;RUMAH DIJUAL GRAHA STUDIO ALAM DEPOK;;;;
1;2;;;Rp 1.037.250.000;JALAN SHARON RAYA UTARA 25CIPAMOKOLAN Rancasari Bandung;Rumah Cahaya Tipe Anantya Siap Huni;;;;
4;4;;;Rp 1.700.000.000;Jl. Kunir No.26 Pd. Cabe Udik Kec. Pamulang Kota Tangerang Selatan Banten 15418 Pondok Cabe Tangerang Selatan;Rumah Cluster Baru 1;;;;
2;3;;;Rp 1.310.000.000;Cluster Swadaya Asri 3 Pondok Ranji Tangerang;Rumah Dijual Siap Huni Asri Lokasi Strategis di Pondok Aren;;;;
11;11;;;Rp 17.000.000.000;Ubud Gianyar;Villa Ubud Bali (Taman Suites Ubud);;;;
3;3;;;Rp 950.000.000;Jalan Boulevard Gajah Mada Tangerang Kota 15139 Indonesia Karawaci Tangerang;Cendana Gard Vista rumah mewah di kawasan lippo karawaci; halaman luas cocok untuk hunian atau usaha;;;
2;3;;;Rp 760.526.992;Jl Gandasoli Cikambuy Katapang Bandung;Rumah Scandinavia di Katapang dekat 2 Tol Soroja dan Katapang Mantul;;;;
3;4;;;Rp 1.800.000.000;Ciracas Jakarta Timur;DICARI PEMBELI RUMAH 2 LANTAI DI PERMATA PURI LAGUNA JALAN RADAR AURI;;;;
3;3;;;Rp 2.700.000.000;Komplek Hotel Amartahills. Jalan Abdul Ghani Atas. Batu Batu;The Villa Amartahills di kota batu;;;;
2;3;;;Rp 795.000.000;mampang Kec. Pancoran Mas Pancoran Mas Depok;Rumah Dijual D'Mirai Alam Serasi Pancoran Mas Depok Free AC;;;;
2;3;;;Rp 750.000.000;Jalan Benda Raya Tangerang Selatan 15434 Indonesia Pamulang Tangerang Selatan;Rumah Minimalis 2 Lantai;;;;
1;2;;;Rp 589.000.000;Serpong Tangerang Selatan;Paradise Serpong city 2; Cicilan 2 Jutaan dan Free Biaya;;;
2;3;;;Rp 740.000.000;Kemang Cimanggis Depok;Rumah 2 LT Siap Huni 5 Menit Tol Cibubur;;;;
1;2;;;Rp 979.056.000;Soekarno Hatta Bandung;RUMAH MODERN MINIMALIS KOTA BANDUNG;;;;
4;5;;;Rp 3.200.000.000;Jagakarsa Jakarta Selatan;Di Jual Cepat Rumah Baru Murah Lokasi Strategis di Jakarta Selatan;;;;
2;3;;;Rp 1.315.000.000;Jl. Jalur Lingkaran Barat Tallasa Boulevard Kel. Parangloe Kec. Tamalanrea Makassar Tamalanrea Makassar;TIPE TERBARU CITRALAND TALLASA CITY MAKASSAR TYPE WINETTA;;;;
1;2;;;Rp 600.000.000;Botania Road No.1 Belian Batam Kota Batam;GLORY HILL BATAM - Cicilan DP Rumah 2 Lantai Hanya 2.8jt/bulan;;;;
1;2;;;Rp 350.000.000;Jalan Haji Kimah Depok 16434 Indonesia Pancoran Mas Depok;Dijual Rumah Hijau Asri Dekat Tol Depok Di Jual Murah;;;;
2;3;;;Rp 590.000.000;Cinangka Sawangan Depok;Rumah 2 LT 5Menit Mall ThePark Sawangan 10Menit Tol Pamulang FreeBiaya;;;;
3;3;;;Rp 1.300.000.000;The flower residence Jln Kramat No A3 Sukatani tapos Depok Tapos Depok;DIJUAL CEPAT BU RUMAH The flower residence NEGO SAMPAI DEAL;;;;
1;2;;;Rp 768.000.000;Jl. Jalur Lingkaran Barat Tallasa Boulevard Kel. Parangloe Kec. Tamalanrea Makassar Tamalanrea Makassar;CITRALAND TALLASA CITY MAKASSAR TYPE GARNET A 72/36 M2 Angsuran 2;;;;
1;2;;;Rp 217.222.223;Perumahan GRAND TAMANSARI -The New Kaliwungu- Jl. Raya Kaliwungu - Boja Kec. Kaliwungu Selatan Kab. Kendal wa‚Å∞‚Å∏‚Åµ‚Åª‚Å∂‚Åµ¬π‚Åª‚Å∞‚Å∞‚Åª‚Åµ‚Åµ‚Åµ‚Å∑ Brangsong Kendal;HUNIAN FASILITAS LENGKAP TERHEBAT DI KENDAL;;;;
1;2;;;Rp 550.000.000;Bojongsari Depok;Village Serua Bojongsari Rumah Murah Dekat Mall The Park Sawangan;;;;
3;3;;;Rp 1.809.000.000;Jl. Jalur Lingkaran Barat Tallasa Boulevard Kel. Parangloe Kec. Tamalanrea Makassar Tamalanrea Makassar;READY STOCK CITRALAND TALLASA CITY MAKASSAR SIAP HUNI;;;;
3;4;;;Rp 2.398.000.000;Jl. Jalur Lingkaran Barat Tallasa Boulevard Kel. Parangloe Kec. Tamalanrea Makassar Tamalanrea Makassar;CITRALAND TALLASA CITY MAKASSAR TYPE JASMINE 162/135 M2 PROGRES BANGUN 4 UNIT;;;;
1;2;;;Rp 350.000.000;JL Kemang pasir putih Depok;Rmh keluarga;;;;
2;3;;;Rp 1.425.000.000;Ciputat Tangerang Selatan;Rumah dijual ciputat grand bintaro asri siap huni biaya kpr all in; Nyaman di Citraland Cirebon;;;
1;2;;;Rp 610.000.000;Kemang Raden Saleh Sukmajaya Depok;Rumah Baru Siap Huni Dekat Grand Depok City Promo DP 0 Gratis Biaya;;;;
3;3;;;Rp 4.200.000.000;Ciputat Tangerang Selatan;Rumah Strategis Siap KPR Dekat Stasiun Sudimara Harga All In Nego;;;;
2;3;;;Rp 849.000.000;Jalan. H. Dehir RT.002/RW.002 Jatiasih Bekasi;Rumah Dijual 2 Lantai Townhouse Panorama Jatiasih Bekasi Bonus AC;;;;
