kamar_mandi;kamar_tidur;Bangunan;Lahan (m≤);harga;lokasi;title;;;;
5;6;;;Rp 3.600.000.000;Jalan Tarumanegara Tangerang Selatan 15446 Indonesia Cirendeu Tangerang Selatan;Rumah Siap Huni under value BU LT 572 M2 Cirendeu Tangsel selankah MRT;;;;
2;3;;;Rp 875.000.000;Jalan Rawa Kalong Bogor Kabupaten 16347 Indonesia Gunung Sindur Bogor;Rumah Baru dalam Komplek BU Lt 200 M2 hanya 10 mnt dr Umpam 2 tangsel;;;;
4;4;;;Rp 2.498.000.000;Jalan Gunung Arjuno 3 NO. 16 Bekasi Kabupaten 17855 Indonesia Cikarang Selatan Bekasi;DIJUAL RUMAH DI CLUSTER MY HOME LIPPO CIKARANG (CALL TO ACTION);;;;
4;4;;;Rp 3.600.000.000;Podomoro River view Gunung Putri Bogor;Dijual cepat rumah mewah hook Podomoro River view Gunung Putri bogor;;;;
1;1;;;Rp 175.000.000;Jalan Cipayung Depok 16442 Indonesia Depok Depok;Dijual Rumah Murah Di Depok Konsep Compact House;;;;
1;2;;;Rp 290.000.000;Jatinangor Sumedang;Rumah dijual di Jatinangor full Renovasi siap huni;;;;
3;3;;;Rp 1.500.000.000;Pondok Cabe Udik Tangerang Selatan;Di Jual Rumah Selangkah Pintu Toll Ciputat;;;;
1;2;;;Rp 175.000.000;Cengkawakrejo Kel. Banyuurip Purworejo Indonesia Purworejo Purworejo;Rumah Transit Bandara YIA di Purworejo;LOKASI STRATEGIS SETU CIKARANG;;;
5;4;;;Rp 5.800.000.000;Sektor 9 Pondok Aren Tangerang;Rumah Hoek Sektor 9 Bintaro Jaya;;;;
2;2;;;Rp 425.000.000;Ungaran Timur Semarang Kabupaten Indonesia Ungaran Timur Semarang;Rumah Cantik Siap Huni Luas Strategis Dekat Exit Tol Ungaran;;;;
3;4;;;Rp 5.300.000.000;Jalan Pajajaran I Solo 57138 Indonesia Sumber Solo;Rumah mewah luas dan asri solo kota;;;;
2;4;;;Rp 1.300.000.000;Cimahi Bandung Raya Indonesia Bandung;Dijual Murah Rumah Baru 2 Lantai di Cluster Cimahi Bandung;;;;
1;2;;;Rp 560.550.000;Jalan Suka Karya II Tangerang Selatan 15414 Indonesia Tangerang Selatan;RUMAH MURAH DI SERUA CIPUTAT TANGERANG SELATAN HARGA 560 JUTA;;;;
5;5;;;Rp 3.900.000.000;jl kalibata raya Kalibata Jakarta Selatan;Dijual Rumah di Kalibata Selatan Pancoran Jakarta Selatan;;;;
2;3;;;Rp 430.000.000;JL. MELUR TUGU IV KEL. TUGU UTARA KEC KOJA KOTA JAKARTA UTARA KOJA JAKARTA UTARA Koja Jakarta Utara;Lelang Rumah 2 Lantai di Koja; ASRI (BEBAS POLUSI UDARA) DAN PRODUKTIF;;;
2;3;;;Rp 750.000.000;Jalan Gagak Hitam Medan 20122 Indonesia Medan Sunggal Medan;Rumah Termurah Di Ringroad Medan Akses Strategis Dekat Mall Manhattan;;;;
1;2;;;Rp 460.000.000;Mojosongo Solo;Promo Perumahan cluster 26 unit di mojosongo jebres murah;MAU ? CICILAN HANYA 900 RB AN;;;
2;3;;;Rp 1.400.000.000;Villa gunung lestari ciputat timur tangerang selatan Ciputat Tangerang Selatan;Nempel St ka sudimara bintaro lt 150 m2 siap huni Villa gunung lestari;;;;
1;4;;;Rp 4.000.000.000;Kalibata Jakarta Selatan;‚≠ïÔ∏è RUMAH Jl. Kalibata Utara I; JAKARTA SELATAN;;;
4;5;;;Rp 1.650.000.000;Bekasi Selatan Bekasi;Rumah 2 Lantai Siap Huni di Komplek Mediterania Cikunir Jatibening;;;;
4;4;;;Rp 3.100.000.000;Grogol Sukoharjo;Rumah Cluster Modern Mewah Full Furnished Area Bisnis Elit Solo Baru;;;;
1;2;;;Rp 355.000.000;Tlogowaru Kel. Kedungkandang Malang Kota Indonesia Kedungkandang Malang;Rumah Modern Lokasi Strategis Dekat Politeknik Kota Malang;;;;
1;2;;;Rp 380.000.000;Pinggir jalan pulau singkep Sukarame Sukarame Bandar Lampung;Cluster Strategis Sukarame Bandar Lampung;;;;
6;4;;;Rp 30.000.000.000;Jakarta Selatan;Rumah Tua di Kemang Timur Jak Sel;;;;
2;3;;;Rp 1.410.000.000;Jalan Lembur Kelurahan Jatirangga Jatisampurna Bekasi;Neo Griya Alecandra Tipe Semira;;;;
1;2;;;Rp 935.000.000;Rancasari Bandung Kota Bandung Raya Indonesia Rancasari Bandung;DIJUAL RUMAH MURAH LANGKA DI GRAND SHARON RESIDENCE RANCASARI BANDUNG;;;;
2;3;;;Rp 995.000.000;cluster Mainroad Kopo Katapang dekat Borma Katapang Soreang Bandung;Jual Cepat Siap Huni Komplek Cluster Mainroad Kopo Katapang Tol Soroja; CICILAN MURAH;;;
2;1;;;Rp 775.000.000;Jalan HM Joni Medan 20217 Indonesia Medan Kota Medan;Villa & Ruko HM Joni - Menteng Raya harga mulai dari 775jt kosong;;;;
4;4;;;Rp 2.450.000.000;PIK 2 PENJARINGAN JAKARTA UTARA Penjaringan Jakarta Utara;Termurah Jual Rumah PIK 2 cluster Cleveland 8x10 Siap Huni.;;;;
2;3;;;Rp 975.000.000;Jl Lele Raya No 6 Bambu Apus Pamulang Pamulang Barat Tangerang Selatan;Cukup Bayar 25 Juta ALL IN Langsung Punya Rumah;;;;
1;2;;;Rp 454.000.000;padalarang Padalarang West Bandung;Diskon DP 30 jt-an Rumah Siap Huni Dekat Kota Baru Parahyangan;;;;
4;5;;;Rp 3.500.000.000;Ciputat Tangerang Selatan;Rumah Mewah Strategis di Ciputat hasil Penjualan untuk bangun Masjid; Kampus UNAIR;;;
1;2;;;Rp 400.000.000;Ngawen Klaten;Rumah Murah di Klaten Dekat Kota;;;;
1;3;;;Rp 600.000.000;Serpong Tangerang Selatan;Rumah Minimalis 2 Lantai di Serpong;;;;
3;3;;;Rp 1.495.000.000;Jalan Lembur Kelurahan Jatirangga Jatisampurna Bekasi;Neo Griya Alecandra Tipe Avida;;;;
3;3;;;Rp 1.485.000.000;Jalan Lembur Kelurahan Jatirangga Jatisampurna Bekasi;Neo Griya Alecandra Tipe Avana;;;;
1;2;;;Rp 535.000.000;jl ringroad sendangadi mlati Mlati Sleman;RUMAH DEPAN KAMPUS UTY JOMBOR 200 M RINGROAD;;;;
1;2;;;Rp 199.000.000;Dumpuh Argodadi Sedayu Bantul;PROMO RUMAH MINIMALIS 199JUTA DI JALAN WATES; IB / 07804;;;
4;4;;;Rp 6.994.291.000;Jl. Lkr. Bumi Botanika Utara Lengkong Kulon Pagedangan Tangerang;The Blizfield at BSD City Tipe 10;;;;
4;4;;;Rp 5.350.000.000;Jl. Lkr. Bumi Botanika Utara Lengkong Kulon Kec. Pagedangan Pagedangan Tangerang;The Blizfield at BSD City Tipe 9;;;;
3;3;;;Rp 780.000.000;Senen Jakarta Pusat;RUMAH 2 LANTAI DI KRAMAT SENEN;;;;
3;5;;;Rp 3.900.000.000;Perumahan Permata Hijau Tlogomas Kota Malang Tlogomas Malang;DIJUAL RUMAH MEWAH DI PERUMAHAN PERMATA HIJAU; Kalisari;;;
5;4;;;Rp 3.950.000.000;jl mh tamrin sentul city Sentul City Bogor;Jual cepat rumah bagus di sentul city;;;;
5;5;;;Rp 5.800.000.000;Bekasi Selatan Bekasi;Rumah MEGAH Asri Aman & Nyaman Di Kemang Pratama Kota Bekasi; TERMINAL TINGKIR DAN MURAH;;;
2;3;;;Rp 1.417.500.000;Parpostel- Jati asih Jatiasih Bekasi;Rumah 2 Lantai- SIAP HUNI- bebas banjir;;;;
24;3;;;Rp 2.200.000.000;Jalan Palagan Tentara Pelajar Sleman 55581 Indonesia Ngaglik Sleman;Dijual Rumah Siap Huni Ada Kolam Renang di Jalan Palagan: Mewah;;;;
2;3;;;Rp 450.000.000;Jalan Sultan Badarudin Bandar Lampung 35154 Indonesia Kedaton Bandar Lampung;Dijual Murah Rumah 2 Lantai di Susunan Baru Bandar Lampung;;;;
5;5;;;Rp 2.750.000.000;jl m kahfi 1 ciganjur Ciganjur Jakarta Selatan;RUMAH BARU SIAP HUNI TANAH LUAS DI M KAHFI 1 JAGAKARSA JAKARTA SELATAN;;;;
2;3;;;Rp 2.045.000.000;Jalan Damai Sleman 55581 Indonesia Ngaglik Sleman;Rumah Cluster Mewah di Jalan Damai Lingkungan Premium Strategis; Cipondoh; Tangerang;;
2;3;;;Rp 657.450.000;Cilangkap Depok;Rumah Dekat Cimanggis Cilangkap Banjaran Pucung Tapos;;;;
2;3;;;Rp 925.640.000;Pamulang Tangerang Selatan;Rumah Pamulang dekat UNPAM dan Pusat Belanja Pamulang;;;;
4;5;;;Rp 2.000.000.000;Turangga dekat Bandung Islami Scholl Turangga Bandung;Dijual rumah di Turangga Selangkah dari Bandung Islami School;;;;
1;2;;;Rp 521.000.000;Jalan Ciwastra Bandung Kota 40286 Indonesia Ciwastra Bandung;Rumah kpr Promo dp 0% Bandung Timur;;;;
4;4;;;Rp 1.800.000.000;Jl. MT Haryono No.53 Karang Anyar Sungai Kunjang Samarinda;The Premiere Hills Tipe Ulin (Upslope);;;;
4;4;;;Rp 4.500.000.000;cluster semayang asya jakarta garden city cakung Cakung Jakarta Timur;Rumah lebar 9 deluxe type 4KT Cluster Semayang Asya JGC Cakung;;;;
19;19;;;Rp 6.500.000.000;Depok Sleman;Rumah Induk+19kt Kost K.Mandi dalam Link Premium Seturan dkt UPN;;;;
1;2;;;Rp 419.691.000;Jl. Raya Cilaku Cilaku Tenjo Bogor;Grand Tenjo Residence - Oakwood Premiere;;;;
1;2;;;Rp 646.000.000;Arcamanik Bandung Kota Bandung Raya Indonesia Arcamanik Bandung;JUAL RUMAH MURAH DI CISARANTEN KULON;;;;
2;2;;;Rp 750.000.000;Pisangan Baru Jakarta Timur;DIJUAL RUMAH 2 LANTAI DI PISANGAN BARU 3 MATRAMAN JAKARTA TIMUR;;;;
2;2;;;Rp 650.000.000;Cipinang Muara Jakarta Timur;DIJUAL CLUSTER MEWAH 2 LANTAI DI CIPINANG MUARA JAKARTA TIMUR;;;;
3;4;;;Rp 2.050.000.000;Jl. MH. Thamrin Cikokol Tangerang;The Terrace at Ayodhya Garden Tipe Pine;;;;
3;4;;;Rp 2.200.000.000;Tohudan Kel. Colomadu Karanganyar Indonesia Colomadu Karanganyar;Jual Rumah Mewah Da Vinci Style Cluster Tohudan Colomadu Solo Barat;;;;
2;3;;;Rp 891.307.800;Cikeas Udik Gunung Putri Bogor;Golden Cikeas Tipe Kerinci;;;;
3;3;;;Rp 2.375.000.000;GREEN LAKE CITY JAKARTA BARAT 11750 INDONESIA DURI KOSAMBI JAKARTA BARAT Duri Kosambi Jakarta Barat;MURAH;;;;
2;2;;;Rp 932.622.000;Jl. Raya Pisangan Satriamekar Bekasi;Darmawangsa Residence - Cluster Sriwijaya Tipe Pandawa;;;;
1;2;;;Rp 453.406.000;Jalan Poros Btp Makassar 90241 Indonesia Tamalanrea Jaya Makassar;Dijual Rumah Mewah Di Makassar. BTP;;;;
2;3;;;Rp 926.500.000;Jalan Metro Raya No.99 Cileungsi Bogor;Cluster New Auckland Tipe L5A ‚Äì Metland Transyogi Cibubur; Jual Rumah Tepi Aspal Dalam Perumahan Jogja Yogyakarta;;;
3;3;;;Rp 3.370.500.000;Jl. Cimanggis Boulevard Tapos Depok;Cluster Nahara Tipe 9 ‚Äì Cimanggis Golf Estate;;;;
2;4;;;Rp 2.500.000.000;Komplek Villa Kelapa Dua Kebon Jeruk Jakarta Barat;Paling Murah rumah di Villa Kelapa Dua;;;;
2;3;;;Rp 1.505.394.000;Jl. Kota Wisata Ciangsana Gunung Putri Bogor;Mississippi Kota Wisata Tipe 97; SISA 1 UNIT;;;
1;2;;;Rp 460.000.000;Jalan Raya Jonggol - Cileungsi Mekarsari Cileungsi Bogor;Cluster HuckleBerry - Grand Mekarsari Residence;;;;
2;2;;;Rp 900.000.000;Jatiasih Bekasi;Rumah Siap Huni di Jatiasih;;;;
2;2;;;Rp 630.000.000;Komplek Bumi Adipura Bandung Kota 40295 Indonesia Gedebage Bandung;Dijual rumah standar Bumi Adipura Gedebage Bandung Lokasi tahap Depan;;;;
1;2;;;Rp 399.489.000;Jl. Raya Cilaku Cilaku Tenjo Bogor;Grand Tenjo Residence - Cluster Botanica Tipe 34/72;;;;
4;5;;;Rp 4.490.000.000;Ngaglik Sleman;Rumah Mewah Luxury Furnish Dalam Perum Elite Taman Palagan Asri;;;;
1;2;;;Rp 668.063.500;Jl. Grand Residence City Boulevard no. 56 Setu Bekasi 17320 Bekasi;Grand Residence City - Bekasi Cluster Visala Tipe 32; Hunian Exlusive; Strategis DP 0% - Kota Bekasi;;
3;4;;;Rp 2.500.000.000;Jalan Puri Tanjung Sari Medan Indonesia Medan Selayang Medan;DiJual Rumah 4 Kamar Tidur di Setia Budi medan;;;;
3;3;;;Rp 1.713.000.000;Jalan Padi Utama Suvarna Sutera Cikupa Tangerang;Cluster Alam Signature Tipe Neo Fairy at Suvarna Sutera;;;;
1;2;;;Rp 707.403.000;Jl. Raya Cisauk No.Raya Suradita Cisauk Tangerang;Springhill Yume Lagoon Tipe Ajisai;;;;
2;3;;;Rp 1.100.000.000;Jalan Anggrek Exit Tol Sirkuit Sentul KM 33 Jagorawi Sentul Bogor;Adhi City Sentul Tipe Aruna Prime;;;;
1;2;;;Rp 175.000.000;jl.kp.paniisan rt.01 rw.14 desa rancamulya kec.pameungpeuk kab.bandung Pameungpeuk Bandung;hunian minimalis di kab bandung harga terjangkau lokasi strategis;;;;
2;2;;;Rp 1.449.000.000;Kedaton bsb city Mijen Semarang;Ready cashback ppn dan free all biaya bsb city;;;;
4;4;;;Rp 1.680.000.000;Jl. Perum bermis Winston residence Suradita Cisauk Tangerang;Winston Residence Tipe Wendelin;;;;
1;2;;;Rp 604.500.000;Jl. Raya Metland Cibitung Wanajaya Cibitung Bekasi;Cluster Lisse Tipe 38 ‚Äì Metland Cibitung;;;;
1;2;;;Rp 700.000.000;Pamulang Tangerang Selatan;Di Jual Rumah Minimalis Tanah Luas di Pamulang;;;;
1;2;;;Rp 808.030.000;Jl. Alam Raya Buahbatu Kec. Bojongsoang Bandung Jawa Barat 40287 Bojongsoang Bandung;Rumah Bandung Timur di Ciwastra Gedebage Buahbatu Margacinta Bojongsoang murah; Hitung Tanah (BU);;;
3;4;;;Rp 2.700.000.000;Taman Banjar wijaya Cluster Lantana Blok A 8 no 6. Cipondoh Tangerang Cipondoh Tangerang;Perumahan elite dekat tol 10 menit ke bandara Soetta .;;;;
3;3;;;Rp 1.650.000.000;jl jagakarsa 1 Jagakarsa Jakarta Selatan;Dijual Rumah Cluster IJO RESIDENCE 2 di Jln Jagakarsa Raya Jakarta Selatan;;;;
2;3;;;Rp 1.700.000.000;Jl. West Coast Green Lake City Cipondoh Tangerang. Cipondoh Tangerang;Rumah Cluster West Coast (uk. 4x15) SHM;;;;
2;3;;;Rp 1.850.000.000;Ngaglik Sleman;Rumah Mewah Strategis Dalam Perum Elite Seputar Hotel Hyatt Palagan;;;;
3;2;;;Rp 1.990.000.000;Jl. Meruya Selatan No.36 RT.5/RW.1 Joglo Kembangan Jakarta Barat;Cluster Lavender Tipe B ‚Äì Puri Botanical;;;;
1;2;;;Rp 401.450.000;Jalan Arco Raya Depok Indonesia Parung Bogor;Rumah Parung dekat Minimarket akses Ciputat Pamulang;;;;
4;5;;;Rp 1.450.000.000;Jalan Lebak Jaya II Tengah Utara Surabaya 60134 Indonesia Kenjeran Surabaya;Rumah Baru Modern Minimalis di Lebak Jaya;;;;
3;4;;;Rp 1.800.000.000;Jalan Langga Raya Lenteng Agung Jagakarsa Jakarta Selatan Lenteng Agung Jakarta Selatan;Rumah Dijual 2 Lantai Harga Terjangkau Daerah Lenteng Agung;;;;
8;8;;;Rp 37.500.000.000;Jln Menteng Utama Bintaro Jakarta Selatan;Dijual rumah mewah kawasan Elit Menteng Residence Bintaro;;;;
2;2;;;Rp 430.000.000;Jalan Suka Karya Pekanbaru 28295 Indonesia Pekanbaru Kota Pekanbaru;Dp 20jt dekat Unri panam;;;;
1;2;;;Rp 462.000.000;Jalan Raya Jonggol ‚Äì Cileungsi Mekarsari Cileungsi Bogor;Cluster Limeberry - Grand Mekarsari Residence;;;;
2;2;;;Rp 450.000.000;Jalan Suka Karya Pekanbaru 28295 Indonesia Pekanbaru Kota Pekanbaru;Rumah ready siap huni di panam;;;;
2;2;;;Rp 1.127.094.000;Jl. Raya Cisauk No.Raya Suradita Cisauk Tangerang;Springhill Yume Lagoon Tipe Sakura;;;;
3;3;;;Rp 975.000.000;Ngaglik Sleman;JUAL RUMAH YOGYAKARTA DEKAT KAMPUS UGM;;;;
2;2;;;Rp 700.980.700;Jl. Lingkar Selatan Suradita Cisauk Tangerang;Golden Park 2 Tipe Viola; dekat pintu tol dan stasiun kereta cigombong.;;;
1;2;;;Rp 571.968.900;Jl. Cempaka Panyirapan Soreang Sukanagara Kec. Soreang Bandung Jawa Barat 40915 Soreang Bandung;Rumah Baru di Bandung Soreang Panyirapan Sukanagara Cempaka Ciwidey Kopo;;;;
1;2;;;Rp 455.000.000;Jl. Sawo Pacung Bitera Gianyar Gianyar;Rumah 2 Kamar;;;;
2;3;;;Rp 1.076.500.000;Jalan Metro Raya No.99 Cileungsi Bogor;Cluster New Auckland Tipe L6A ‚Äì Metland Transyogi Cibubur;;;;
2;3;;;Rp 2.100.000.000;Jalan Perumahan Pondok Tjandra Indah Sidoarjo 61256 Indonesia Sidoarjo;MURAH Rumah BARU 2 Lt Minimalis Ruby Pondok Tjandra Depan Club House;;;;
2;2;;;Rp 770.000.000;Jl. Imogiri Barat Km 7 Bibis Timbulharjo Sewon Bantul;Tjokro Boulevard Tipe 65;;;;
1;2;;;Rp 321.300.000;Jl. Raya Cibunar Cibunar Parung Panjang Bogor;Serpong Green Paradise Tipe Techno;;;;
3;4;;;Rp 4.024.007.135;Jl. Kampung Pekopen No.47 RT.4/RW.5 Lambangjaya Kec. Tambun Sel. Kabupaten Bekasi Jawa Barat 17510 Tambun Selatan Bekasi;Grand Wisata Water Terrace II Flawless Living Tipe Blue 151;;;;
2;3;;;Rp 1.630.000.000;Jalan Anggrek Exit Tol Sirkuit Sentul KM 33 Jagorawi Sentul Bogor;Adhi City Sentul Tipe Agra Deluxe;;;;
1;2;;;Rp 191.691.500;Perumahan Permata Mutiara Maja Maja Lebak;Permata Mutiara Maja Tipe Lavender;;;;
2;3;;;Rp 1.478.200.000;Cempaka Putih Jakarta Pusat;Dijual hunian cempaka putih barat Jakarta pusat;;;;
3;4;;;Rp 6.400.000.000;Wisata Bukit Mas Blok G Wiyung Surabaya;Dijual rumah FULL FURNISH Wisata Bukit Mas;;;;
1;3;;;Rp 670.000.000;Jln.Stella Tengah Kec.Medan Tuntungan Kota Medan Sumatera Utara 20135 Simpang Selayang Medan;Rumah DiJual di Jl.Stella Tengah yang Masih Sejuk;;;;
2;2;;;Rp 1.035.000.000;Jalan Kawasan Puspitek Suradita Cisauk Tangerang;Golden Park 3 Tipe Artemis;;;;
23;6;;;Rp 2.500.000.000;Pasir Kernceng 77 Pamekaran Kec. Soreang Kabupaten Bandung Jawa Barat 40911 Soreang Bandung;Rumah Murah di Bandung;;;;
1;2;;;Rp 481.500.000;Jl. Raya Cibunar Cibunar Parung Panjang Bogor;Serpong Green Paradise Tipe Orchid 1 Lantai;;;;
2;5;;;Rp 3.800.000.000;Jakarta Selatan;Rumah kebayoran lama jakarta selatan;;;;
5;4;;;Rp 2.800.000.000;Jl. MT Haryono No.53 Karang Anyar Sungai Kunjang Samarinda;The Premiere Hills Tipe Bengkirai (Upslope);;;;
3;3;;;Rp 4.450.000.000;Jl Perkici Bintaro sektor 5 Ciputat Tangerang Selatan Bintaro Tangerang Selatan;Rumah lokasi strategis di Bintaro sektor 5;;;;
3;3;;;Rp 1.726.272.000;Jl. Raya Cisauk No.Raya Suradita Cisauk Tangerang;Springhill Yume Lagoon Tipe Himawari;;;;
3;4;;;Rp 2.797.000.000;Jl. Raya Bojongsari Kedaung Bojongsari Depok;Sutera Sawangan Tipe Ruby;;;;
2;2;;;Rp 1.595.000.000;Jalan Palmerah Utara 4 Jakarta Barat 11480 Indonesia Palmerah Jakarta Barat;di jual hunian mewah aman dan nyaman di palmerah;;;;
2;3;;;Rp 2.071.000.000;Jalan Anggrek Exit Tol Sirkuit Sentul KM 33 Jagorawi Sentul Bogor;Adhi City Sentul Tipe Agra Prime;;;;
3;3;;;Rp 893.250.000;Jl. Raya Cikarang - Cibarusah Sukadami Cikarang Selatan Bekasi;Tipe Maple - Cifest;;;;
3;4;;;Rp 2.756.000.000;Jalan Padi Utama Suvarna Sutera Cikupa Tangerang;Cluster Meranti Tipe Mahogani at Suvarna Sutera;;;;
1;1;;;Rp 501.000.000;Karang Tengah Pagedangan Tangerang;Golden Flower Legok Tipe Amaryllis Basic Plus;;;;
2;3;;;Rp 826.000.000;Karang Tengah Kec. Pagedangan Tangerang Banten 15330 Karang Tengah Tangerang;Golden Flower Legok Tipe Chrysant; Bekasi;;;
1;2;;;Rp 490.000.000;Kertonatan Kel. Kartasura Sukoharjo Indonesia Kartasura Sukoharjo;Rumah Cluster Baru Murah Strategis dekat Bandara dan Tol Solo Barat;;;;
4;3;;;Rp 2.348.400.000;Sawangan Lama Sawangan Depok;Shila at Sawangan Cluster Tilia Courtyard Plus;;;;
2;2;;;Rp 999.000.000;PERUMAHAN DEPOK BERSIH Depok Depok;RUMAH DP 35 JUTA BISA KPR;;;;
4;4;;;Rp 1.100.000.000;Ngaglik Sleman;Rumah Murah Minimalis Tanah Luas Dalam Perum Jl. Kaliurang Km. 8;;;;
3;4;;;Rp 2.880.000.000;Jalan Suvarna Sutera Boulevard No. 10 Cikupa Tangerang;Cluster Eldora Tipe Elodea+ at Suvarna Sutera;;;;
2;3;;;Rp 1.641.963.736;Jl. Kw. Grand Wisata RT.006/RW.016 Mustika Jaya Mustika Jaya Bekasi;Grand Wisata - Z Living Tipe Modern;;;;
2;3;;;Rp 1.179.667.800;Jl. Lingkar Selatan Suradita Cisauk Tangerang;Golden Park 2 Tipe Azalea;;;;
5;8;;;Rp 85.000.000.000;Jalan Plaju Jakarta Pusat 10230 Indonesia Thamrin Jakarta Pusat;Harus Terjual Harga BU Rumah Di Kawasan Strategis Sudirman Jakarta;;;;
2;6;;;Rp 4.000.000.000;Graha Padma Semarang Barat Semarang;Rumah di Graha Padma ;;;;
4;5;;;Rp 3.300.000.000;jl pejaten barat Pejaten Barat Jakarta Selatan;Dijual Murah Rumah Mewah di Pejaten Barat Pasar Minggu Jakarta Selatan;;;;
2;3;;;Rp 1.627.401.000;Sawangan Lama Sawangan Depok;Shila at Sawangan Cluster Tilia Terrace Plus; Jakarta Selatan;;;
3;3;;;Rp 1.005.600.000;Rawamangun Jakarta Timur;dijual rumah dekat tol rawamangun; Dua lantai daerah Bekasi kota; Murah Dan strategis; DP 0% - Bekasi;
4;3;;;Rp 2.785.298.000;Sawangan Lama Sawangan Depok;Shila at Sawangan Cluster Tilia Courtyard Corner;;;;
2;3;;;Rp 960.400.000;Jalan Kawasan Puspitek Suradita Cisauk Tangerang;Golden Park 3 Tipe Hermes;;;;
1;2;;;Rp 672.000.000;Cogreg Gunung Sindur Bogor;Golden Hills Tipe Assisi;;;;
3;3;;;Rp 1.944.593.000;Jl. Golf No.7 RT.4/RW.7 Sawangan Lama Sawangan Depok;Shila at Sawangan Cluster Lake Series Laguna Tipe Mondrian;;;;
1;2;;;Rp 361.860.000;Jl. Raya Cilaku Cilaku Tenjo Bogor;Grand Tenjo Residence - Oakwood Suite;;;;
2;3;;;Rp 989.000.000;Gubeng Surabaya;Northwest Park PROMO New Type Athena ;;;;
2;2;;;Rp 826.027.750;Jalan Dirgantara Raya Jatisari Jatiasih Bekasi;Taman Jatisari Permai Tipe 54;;;;
1;2;;;Rp 612.000.000;Cogreg Gunung Putri Bogor;Golden Hills Tipe Verona;;;;
4;5;;;Rp 3.300.000.000;wibawa mukti 2 Jatiasih Bekasi;Rumah baru di Satwika Permai Jatiasih;;;;
1;2;;;Rp 1.150.000.000;Mijen Semarang;rumah mewah forest hill citraland BSB;;;;
3;4;;;Rp 5.580.000.000;Jalan Haji Saaba Jakarta Barat Indonesia Joglo Jakarta Barat;Dijual rumah madja residence at puri di joglo jakarta barat;;;;
4;5;;;Rp 57.000.000.000;Jalan Riau - RE Martadinata Bandung Riau Bandung;Rumah Di Lokasi Premium Main Road Jalan Riau RE Martadinata Bandung;;;;
1;2;;;Rp 310.000.000;Jl. Pedusan Argorejo Sedayu Sedayu Bantul;Rumah Murah Meriah Siap Bangun Sedayu;;;;
2;3;;;Rp 2.116.800.000;Jalan Raya Sultan Hasanudin Tambun Selatan Bekasi;Metland Tambun Bekasi Tipe Azalea;;;;
2;4;;;Rp 50.000.000.000;Kebayoran Baru Jakarta Selatan;Rumah Dijual Di Dharmawangsa Prapanca Kebayoran Baru Jakarta Selatan;;;;
1;2;;;Rp 959.000.000;Cibinong Gunung Putri Bogor;Golden Hills Tipe Siena Premium;;;;
2;5;;;Rp 3.200.000.000;Antasari Jagabaya I Bandar Lampung;Rumah Murah Villa Citra Antasari;;;;
2;3;;;Rp 500.000.000;kelapa warna Labuhan Ratu Bandar Lampung;Rumah Mewah Tanjung Senang;;;;
1;2;;;Rp 1.560.000.000;Terusan Buah Batu Buahbatu Bandung;Cluster Sadyagriya at Podomoro Park Bandung;;;;
2;3;;;Rp 1.140.000.000;Serpong Tangerang Selatan;Dijual Rumah Siap Huni di Paradise Serpong City;;;;
3;3;;;Rp 1.816.717.000;Jl. Kota Wisata Ciangsana Gunung Putri Bogor;Mississippi Kota Wisata Tipe 121;;;;
2;3;;;Rp 2.014.500.000;Jl. Raya Cikarang - Cibarusah Sukadami Cikarang Selatan Bekasi;Tipe La Spezia - Cifest;;;;
5;5;;;Rp 6.350.000.000;Casa Tobago Grand Island Pakuwon City Surabaya Mulyorejo Surabaya;Rumah Baru Minimalis 2 Lantai Casa Tobago;;;;
3;3;;;Rp 1.325.000.000;Jl. Kp. Pondok Sentul 45 Ciater Serpong Tangerang Selatan;Yamala Haus Tipe BU;;;;
2;3;;;Rp 1.477.000.000;Rawamangun Jakarta Timur;dijual rumah murah aman nyaman asri di pemuda;;;;
1;2;;;Rp 717.000.000;Karang Tengah Kec. Pagedangan Tangerang Banten 15330 Karang Tengah Tangerang;Golden Flower Legok Tipe Daisy Lite;;;;
2;3;;;Rp 1.636.150.000;Jl. Raya Cikarang - Cibarusah Sukadami Cikarang Selatan Bekasi;Tipe La Venoza - Cifest;;;;
1;1;;;Rp 1.068.840.000;Jalan Harvest City Boulevard Cipenjo Cileungsi Bogor;Cluster The Laurus Tipe 1 ‚Äì Harvest City; Rumah subsidi; Ready Stok;;
1;2;;;Rp 1.322.990.650;Jl. Lingkar Selatan Suradita Cisauk Tangerang;Golden Park 2 Tipe Cananga; dekat ke 2 MRT;;;
5;6;;;Rp 9.200.000.000;Srengseng Sawah Jagakarsa Jakarta Selatan Jagakarsa Jakarta Selatan;DIJUAL Rumah Pribadi;;;;
4;5;;;Rp 3.960.000.000;Jalan Dukuh IV Jakarta Timur 13550 Indonesia Kramat Jati Jakarta Timur;Dijual Cepat Rumah di Jalan Dukuh Kramat Jati Jakarta Timur;;;;
5;6;;;Rp 24.000.000.000;Jalan Pancoran Timur 5 Jakarta Selatan 12770 Indonesia Pancoran Jakarta Selatan;Dijual Rumah Harga Dibawah NJOP di Komplek Liga Mas Indah Pancoran Jak;;;;
1;2;;;Rp 767.000.000;Cogreg Gunung Sindur Bogor;Golden Hills Tipe Fano;;;;
1;2;;;Rp 1.081.603.000;Jalan Wates KM 11 (Depan PLN Sedayu) Bandut Lor Argorejo Sedayu Bantul;Royal Sedayu Residence Tipe 56;;;;
3;7;;;Rp 5.000.000.000;Jl. Kedung Mangu No. 89 Surabaya;Dijual Rumah Usaha;;;;
3;2;;;Rp 2.000.000.000;Jl. Meruya Selatan No.36 RT.5/RW.1 Joglo Kembangan Jakarta Barat;Cluster Lavender Tipe A2 ‚Äì Puri Botanical;;;;
4;4;;;Rp 2.914.622.000;Jl. Golf No.7 RT.4/RW.7 Sawangan Lama Sawangan Depok;Shila at Sawangan Cluster Lake Series Vista Tipe Tudor;;;;
2;2;;;Rp 6.834.000.000;Jl. Raya Pagelarang no. 99 Setu Cipayung Jaktim Cipayung Jakarta Timur;Rumah Strategis Dekat TMII;;;;
1;2;;;Rp 385.000.000;Jalan Perumahan Sentraland Paradise Bogor Kabupaten Indonesia Parung Panjang Bogor;Rumah Minimalis Sentraland Paradise 36/72 Parung Panjang Dekat BSD;;;;
1;2;;;Rp 675.000.000;Perumahan Citra sentosa lakar santri surabaya Lakarsantri Surabaya;Rumah Citra Sentosa SHM 1lt strategis lokasi nyaman row 3 mobil;;;;
1;2;;;Rp 360.050.000;Jl. Raya Cibunar Cibunar Parung Panjang Bogor;Serpong Green Paradise Tipe Tulip;;;;
1;2;;;Rp 370.750.000;Bekasi;Rumah Cantik Fasilitas Lengkap Harga Terjangkau Dutaland Residence Bekasi;;;;
3;3;;;Rp 1.100.000.000;Jln.Sei Kapuas Komplek Gajah Mada Vista Medan Babura Sunggal Medan;DiJual Rumah dekat jln.Gajah Mada Medan;;;;
4;5;;;Rp 5.500.000.000;Sukolilo Surabaya;Rumah Minimalis PURI GALAXI; SHM;;;
4;3;;;Rp 1.771.601.000;Sawangan Lama Sawangan Depok;Shila at Sawangan Cluster Tilia Courtyard Standard;;;;
5;6;;;Rp 24.000.000.000;Jalan Pancoran Timur 5 Jakarta Selatan 12770 Indonesia Pancoran Jakarta Selatan;Dijual di Bawah NJOP Rumah di Komplek Liga Mas Indah Pancoran Jakarta;;;;
2;2;;;Rp 1.241.280.000;Jalan Raya Sultan Hasanudin Tambun Selatan Bekasi;Metland Tambun Bekasi Tipe Lily;;;;
1;2;;;Rp 799.000.000;Cogreg Gunung Sindur Bogor;Golden Hills Tipe Siena Lite Premium;;;;
3;3;;;Rp 1.270.000.000;Jl. Kp. Pondok Sentul 45 Ciater Serpong Tangerang Selatan;Yamala Haus Tipe B;;;;
2;2;;;Rp 1.105.700.000;Rawamangun Jakarta Timur;Dijual hunian cipinang kebembem Rawamangun Jakarta timur;;;;
2;3;;;Rp 1.335.450.900;Jl. Lingkar Selatan Suradita Cisauk Tangerang;Golden Park 2 Tipe Jasmine;;;;
2;2;;;Rp 1.283.000.000;Jalan Anggrek Exit Tol Sirkuit Sentul KM 33 Jagorawi Sentul Bogor;Adhi City Sentul Tipe Agra Standard;;;;
3;3;;;Rp 2.750.000.000;Jl. Taman Semanan Raya No.8 RW.11 Duri Kosambi Cengkareng Jakarta Barat;Virya Semanan Tipe 6;;;;
2;2;;;Rp 960.775.650;Jl. Lingkar Selatan Suradita Cisauk Tangerang;Golden Park 2 Tipe New Amarilis;;;;
2;3;;;Rp 1.595.530.000;Jl. Lingkar Selatan Suradita Cisauk Tangerang;Golden Park 2 Tipe Mahogany;;;;
3;3;;;Rp 884.200.000;Jl. Permata No.3 Rawakalong Gunung Sindur Bogor;Bali Resort Extension Tipe Bali Haus+;;;;
1;2;;;Rp 644.280.000;Jalan Harvest City Boulevard Cipenjo Cileungsi Cileungsi Bogor;Cluster Sakura Indica Tipe Megame ‚Äì Harvest City;;;;
1;1;;;Rp 719.000.000;Parung Bogor;Jual perumahan kemang eminence;2 lantai 300 jtan akses 2 mobil di depok;;;
16;16;;;Rp 10.600.000.000;Jl. Wr Supratman Kampung Utan Ciputat Tangerang Selatan Ciputat Tangerang Selatan;Dijual Kontrakan 16 Pintu luas dan Strategis Di Ciputat Gg. Jambu Tangsel;;;;
2;2;;;Rp 1.948.000.000;Jl. Raya Bojongsari Kedaung Bojongsari Depok;Sutera Sawangan Tipe Topaz;;;;
2;2;;;Rp 1.068.840.000;Jalan Harvest City Boulevard Cipenjo Cileungsi Bogor;Cluster The Laurus Tipe 2 ‚Äì Harvest City;;;;
2;3;;;Rp 891.255.000;Jl. Grand Residence City Boulevard no. 56 Setu Bekasi 17320 Bekasi;Grand Residence City - Bekasi Cluster Visala Tipe 54;;;;
4;6;;;Rp 4.300.000.000;Citra Garden 2 Jakarta Barat 11830 Indonesia Cengkareng Jakarta Barat;DIJUAL CEPAT RUMAH CITRA GARDEN 2 UKURAN 10 X 16 JAKARTA BARAT;;;;
2;3;;;Rp 1.319.000.000;Jalan Kawasan Puspitek Suradita Cisauk Tangerang;Golden Park 3 Tipe Luna;;;;
1;2;;;Rp 395.000.000;Bandar Lampung;Rumah Dekat UIN Bandar Lampung;;;;
2;3;;;Rp 1.151.000.000;Gunung Sindur Bogor;Golden Hills Tipe Andalusia;;;;
1;2;;;Rp 667.132.200;Cikeas Udik Gunung Putri Bogor;Golden Cikeas Tipe Rinjani;;;;
2;3;;;Rp 1.880.929.000;Sawangan Lama Sawangan Depok;Shila at Sawangan Cluster Tilia Terrace Corner;;;;
