kamar_mandi;kamar_tidur;Bangunan;Lahan (m≤);harga;lokasi;title;;;;
;2;30;;Rp 340.000.000;Jl. Ciherang RT.003/RW.007 Ciherang Kec. Dramaga Kabupaten Bogor Jawa Barat 16680 Dramaga Bogor;DIJUAL RUMAH CLUSTER SYARIAH SAYYIDAH VILLAGE DEKAT KOTA BOGOR;;;;
;2;30;;Rp 150.000.000;Majalaya Bandung;HANYA DISINI DI MAJALAYA RUMAH SUBSIDI NO DP;;;;
;1;30;;Rp 295.000.000;Rawabadak Selatan Jakarta Utara;DIJUAL CEPAT rumah murah jakarta utara rawabadak selatan;;;;
;3;145;;Rp 1.800.000.000;Jagakarsa Jakarta Selatan;RUMAH MEWAH MURAH JAGAKARSA;;;;
;2;38;;Rp 400.000.000;Gunung Sindur Bogor;Rumah minimalis modern parung;;;;
;3;143;;Rp 1.550.000.000;Oro-oro Ombo Batu;villa luas tanah 170m≤ dan 140m≤ dekat jatimpark 2;;;;
;2;27;;Rp 150.500.000;Serpong Tangerang Selatan;RUMAH SUBSIDI KINTAMANI DI CITRA MAJA RAYA;;;;
;4;270;;Rp 3.500.000.000;Jatibening Bekasi;Dijual Rumah - di perbatasan Jakarta Timur (Komplek Jatibening Dua);;;;
;2;36;;Rp 400.000.000;Maja Lebak;RUMAH HOOK - 2 KAMAR DIJUAL;;;;
;5;170;;Rp 1.700.000.000;Sarua Tangerang Selatan;jual rumah pribadi;;;;
;2;50;;Rp 500.000.000;Kelapa Dua Wetan Jakarta Timur;Rumah Mewah Murah Diciracas Kelapa Dua Wetan Jaktim;;;;
;2;45;;Rp 500.000.000;Jl. Ke RM Pondok Hijau Terusan Griya Indah 4 ) Mapanget Manado Sulawasi Utara Mapanget Kec. Talawaan Kabupaten Minahasa Utara Sulawesi Utara 95258 Mapanget Manado;Rumah murah Milenial Manado Tokyo House Tribeca Park Pertama di Sulawesi Utara;;;;
;3;60;;Rp 425.000.000;Tegalbesar Jember;Perumahan Syariah Premium Tegal Besar Jember Dekat Bandara Noto Hadi Negoro;;;;
;1;36;;Rp 250.000.000;Jalan haji musanip Gandaria Jakarta Selatan;Jual butuh dan murah rumah bedeng daerah Gandaria I.; dekat Pasar Jangkang. View Merapi;;;
;3;45;;Rp 825.000.000;Pondok Benda Pamulang Tangerang Selatan Pamulang Tangerang Selatan;rumah 25jt di Pamulang Tanggerang selatan Unit ready;;;;
;4;150;;Rp 1.500.000.000;Kalisari Jakarta Timur;Jual Rumah Murah di Pasar Rebo;;;;
;2;73;;Rp 270.000.000;Gg Jambu RT. 04 RW. 07 NGepos Kel. Tingkir Tengah Kec. Tingkir Salatiga 50745 Tingkir Tengah Salatiga;RUMAH STRATEGIS DEKAT PINTU TOL;;;;
;2;30;;Rp 390.000.000;Dramaga Bogor;DIJUAL Rumah Smarthome Dekat IPB DRAMAGA BOGOR;;;;
;10;800;;Rp 70.000.000.000;Jagakarsa Jakarta Selatan;dijual cepat rumah mewah di jagakarsa jaksel;;;;
;3;80;;Rp 675.000.000;Nanggewer Bogor;Rumah Siap Huni di Cibinong Bogor;;;;
;2;95;;Rp 1.350.000.000;Pondok Melati Bekasi;Dijual Ruko di Jatirahayu Jalan Raya Hankam;;;;
;2;38;;Rp 460.000.000;Cibubur Jakarta Timur;Jual Cepat Rumah Type 38/180 di perumahan Citra Indah City;;;;
;2;56;;Rp 450.000.000;Cibinong Bogor;assalamualaikum ...segera dijual rumah baru;;;;
;3;70;;Rp 775.000.000;Maguwoharjo Sleman;Dekat Jogja Bay;;;;
;1;27;;Rp 500.000.000;Bumi Serpong Damai Tangerang Selatan;cukup dengan 10 JT saja sudah memiliki rumah sendiri;;;;
;2;30;;Rp 150.500.000;Delanggu Klaten;Rumah subsidi klaten;;;;
;2;29;;Rp 150.000.000;Serang Serang;perumahan subsidi Cikande Serang Banten;;;;
;2;48;;Rp 450.000.000;Cilebut Bogor;dua lantai harga satu lantai;;;;
;3;65;;Rp 1.340.000.000;Jalan sliwangi Pamulang Tangsel Pondok Benda Baru Tangerang Selatan;Rumah Idaman di Pamulang Tangerang Selatan;Amplaz;;;
;2;42;;Rp 307.000.000;Besar Medan;Perumahan Elemen Martubung;;;;
;2;27;;Rp 495.000.000;medayu utara surabaya timur Surabaya;Rumah Dijual Di Surabaya Timur Siap Huni; ARCAMANIK - KOTA BANDUNG 600-AN;;;
;3;69;;Rp 1.300.000.000;Bintaro Jakarta Selatan;Rumah Cluster Neo Bintaro;;;;
;3;60;;Rp 850.000.000;Pasar Minggu Jakarta Selatan;Dijual Rumah;;;;
;2;60;;Rp 525.000.000;Batam;Rumah 2 lantai paling murah dibatam golden city cicilan mulai dari 4juta/bulan;;;;
;6;275;;Rp 5.500.000.000;Mulyorejo Surabaya;Dijual Rumah+Kantor di Manyar SHM furnished strategis tengah kota SBY;;;;
;2;30;;Rp 150.000.000;Banjaran Bandung;JARANG RUMAH SUBSIDI MURAH DAN KEREN CICILAN 900 RIBUAN DI BANJARAN KAB BANDUNG;Arcamanik masih nego;;;
;2;62;;Rp 1.200.000.000;Gunung Putri Bogor;PODOMORO GOLF VIEW Type THE COTTAGE;;;;
;2;60;;Rp 680.000.000;Jatimakmur Bekasi;Dijual rumah cluster di jatimakmur;;;;
;3;60;;Rp 530.000.000;Rejomulyo Kediri;Rumah Komersil 60/77 kota;;;;
;3;200;;Rp 4.200.000.000;GREENWICH Sumur Welut Surabaya;Dijual Rumah Royal Residence Cluster Greenwich;;;;
;4;250;;Rp 1.999.000.000;jalan tuban raya nomor 35 Bubutan Surabaya;DIJUAL RUMAH KENANGAN MASA KECIL DI TUBAN RAYA SURABAYA; Rumah Green Lake City Europe; Duri Kosambi; Jakarta Barat;
;2;36;;Rp 265.000.000;Kalasan Sleman;RUMAH MODERN MINIMALIS DEKAT KOTA JOGJA;;;;
;3;92;;Rp 450.000.000;Pall Merah Jambi;Jual Rumah Lb 92m≤ Lt 144m≤ArtaUli 2 Paal Merah Jambi Selatan;;;;
;5;240;;Rp 2.000.000.000;Banjarsari Solo;Jual Cepat Rumah Mewah sumber Banjarsari Solo;;;;
;4;115;;Rp 895.000.000;RAJA BASA BANDAR LAMPUNG Rajabasa Bandar Lampung;RUMAH MEWAH DI RAJA BASA;Siap Huni;;;
;4;150;;Rp 1.000.000.000;Sukodono Sidoarjo;Rumah Jalan Kembar dekat Tol Sidoarjo Jalan Puri Indah;;;;
;2;30;;Rp 143.000.000;Babakan Cikao Purwakarta;DP RUMAH MURAH PURWAKARTA;;;;
;2;36;;Rp 162.000.000;Medan;Rumah subsidi desain mezanin batang kuis DP 7.5 Jt all in; lokasi bagus; dekat dengan club house; bebas banjir;
;2;36;;Rp 185.000.000;Sleman Sleman;villa siap bangun;;;;
;3;60;;Rp 795.000.000;Tirtajaya Sukmajaya Depok Sukmajaya Depok;HUNIAN STRATEGIS DI PUSAT KOTA DEPOK; Cocok Dibikin Kontrakan;;;
;5;160;;Rp 1.700.000.000;Mulyorejo Surabaya;Dijual Rumah Mulyosari Surabaya;;;;
;2;52;;Rp 250.000.000;Kelurahan cipayung jaya Rt 01 Rw 06 Kec Cipayung Kota Depok Cipayung Jaya Depok;Di Jual Rumah Siap Huni Lokasi Startegis Cipayung Kota Depok;;;;
;3;70;;Rp 790.000.000;Cimanggis Depok Cibubur Jakarta Timur;Dijual Rumah Mewah Diapit 2 AKses Tol - Cibubur Depok;;;;
;10;276;;Rp 900.000.000;Karawang Barat Karawang;Jual Kontrakan 8 Pintu Galuh Mas Karawang;;;;
;4;125;;Rp 2.700.000.000;Sentul City Bogor;The sanctuary newton springs sentul;;;;
;14;126;;Rp 850.000.000;Jalan Manyar Sakti Pekanbaru 28293 Indonesia Tampan Pekanbaru;Dijual Kosan 14 Kamar Jl. Mayer Sakti Gg Ababil Panam Pekanbaru;;;;
;2;35;;Rp 150.000.000;Citayam Depok;Rumah Baru & Murah;;;;
;2;50;;Rp 500.000.000;Jl. mustika jaya - kota bekasi Mustika Jaya Bekasi;Rumah murah;;;;
;3;68;;Rp 790.000.000;Cimanggis Depok Cimanggis Depok;Dijual Rumah 2 lantai dgn Nuansa Tropis dekat tol cibubur depok;;;;
;2;85;;Rp 350.000.000;Banjarsari Solo;RUMAH MURAH DI BARAT LUWES GENTAN SURAKARTA;;;;
;5;815;;Rp 15.000.000.000;Surabaya;Dijual Rumah Satelit Surabaya;;;;
;3;120;;Rp 2.100.000.000;Tambun Selatan Bekasi;Rumah murah dan nyaman di Bekasi;;;;
;2;42;;Rp 270.000.000;Pakem Sleman;Rumah siap Huni di Sleman Yogyakarta;;;;
;2;36;;Rp 500.000.000;Cimanggis Depok;Di Jual Rumah Baru Tapos Cimanggis Depok; Tengaran;;;
;4;175;;Rp 1.300.000.000;Kuta Badung;Rumah dekat canggu nego sampai deal;;;;
;5;250;;Rp 3.500.000.000;Grand Wisata - Cluster Water Spring Tambun Selatan Bekasi;Rumah Full Furnished di Grand Wisata Cluster Water Spring;;;;
;4;300;;Rp 3.950.000.000;Dago Bandung;Dijual Cepat Murah Rumah Lux Full Furnished di Resort Dago;;;;
;2;33;;Rp 394.537.500;Jl kayu manis VIII Jakarta Timur;Dijual rumah murah baru dijakarta;;;;
;3;150;;Rp 500.000.000;Bogor Utara - Kota Bogor;Jual Cepat Rumah Komplek PGRI Kedung Halang Bogor;;;;
;3;150;;Rp 1.400.000.000;Gadog ciawi Puncak Bogor;Rumah vila villa asri 2 lantai view gunung Gadog puncak 3 kamar ciawi Bogor; DP 14 JT TANPA BIAYA LAGI;;;
;5;170;;Rp 1.650.000.000;Jagakarsa Jakarta Selatan;Rumah Lux modern classic di jagakarsa jaksel;;;;
;3;80;;Rp 499.000.000;Gedongan Karanganyar;Rumah Dekat Bandara;;;;
;2;40;;Rp 285.000.000;Sawangan Depok;Rumah Mewah Dan Berkualitas Harga Terjangkau;;;;
;2;73;;Rp 790.209.000;Jl. Imam Bonjol KM 11 Bandar Lampung;Rumah Baru 2 Lantai Dijual Murah di Springhill Bandar Lampung;;;;
;3;85;;Rp 800.000.000;Jl. H. Irin RW.8 Lebak Bulus Cilandak South Jakarta City Jakarta 12440 Cilandak Jakarta Selatan;DIJUAL Rumah di Pondok Labu Fatmawati Jaksel Lokasi Sangat Strategis;;;;
;2;30;;Rp 168.000.000;Jln raya bojong pebayuran desa kedung waringin Bekasii Cikarang Timur Bekasi;Rumah Subsidi di Cikarang dan karawang;;;;
;2;45;;Rp 495.500.000;Tapos Depok;BANJARAN GRAND RESIDENCE rumah 2 lantai di Depok Bogor;;;;
;5;200;;Rp 1.800.000.000;Jimbaran Badung;DIJUAL RUMAH 3 LANTAI DI KOR JIMBARAN;;;;
;2;50;;Rp 770.000.000;Serpong Tangerang Selatan;Rumah siap huni minimalis serpong;;;;
;2;45;;Rp 600.000.000;Mustika Jaya Bekasi;MAROCCO VIEW RESIDENCE RUMAH 2LT Angsuran mulai 3jtaan;;;;
;2;50;;Rp 350.000.000;Mangunsari gunungpati Gunungpati Semarang;Rumah siap huni dekat unnes;;;;
;3;70;;Rp 847.500.000;Soekarno Hatta Bandung;Rumah Minimalis Modern 2 Lt Dkt Sekolah Citra Cemara 3 Bahasa Bandung;;;;
;4;147;;Rp 1.525.000.000;Nirwana Eksekutif Rungkut Surabaya;Dijual Rumah Nirwana Eksekutif;;;;
;2;33;;Rp 235.000.000;Cilodong Depok;Cluster 1 lantai 200 jtan; Rumah Lantai 2 Harga Lantai 1;;;
;4;250;;Rp 4.950.000.000;Jagakarsa Jakarta Selatan;RUMAH MEWAH DALAM KOMPLEK JAGAKARSA;;;;
;2;27;;Rp 150.000.000;Bagendung Cilegon;Perumahan Subsidi Bukit Cilegon Asri;;;;
;4;158;;Rp 1.950.000.000;Jongaya Makassar;Dijual Rumah Mewah;;;;
;2;440;;Rp 25.000.000.000;Jl. Raya Kenjeran Kenjeran Surabaya;Rumah + Gudang Nol Jalan Raya Kenjeran Surabaya;;;;
;2;36;;Rp 263.000.000;Prambanan Sleman;Rumah Modern Minimalis Dekat Jalan Jogja Solo;;;;
;3;48;;Rp 475.000.000;Mulyorejo Malang;De Royal Nirwana ( Sukun );;;;
;2;36;;Rp 250.000.000;Serang Baru Bekasi;Beli Rumah dapat Toko;;;;
;2;36;;Rp 299.000.000;Sekaran Semarang;Rumah pesan Bangun diSekaran Unnes;;;;
;4;100;;Rp 1.610.000.000;Cinere Depok;RUMAH MODERN DESIGN SCANDINAVIA TROPIS DI CINERE;;;;
;5;138;;Rp 2.500.000.000;Karawaci Tangerang;Rumah Baru di Perumahan Islamic Village;;;;
;2;30;;Rp 178.000.000;Jayanti Tangerang;Grand harmony 3 jayanti; Bagus Di Tomang Jakarta Barat Bisa Nego;;;
;2;45;;Rp 508.000.000;Bengkong Batam;MONDE RAFLLE RESIDENCE BENGKONG LAUT BATAM cicilan 3jutaan; Green Lake City; Tangerang.;;
;1;21;;Rp 226.500.000;Cipayung Depok;Rumah Mezzanine 200juta Depok;;;;
;2;35;;Rp 230.000.000;Citayam Depok;rumah Citayam bojonggede;;;;
;3;45;;Rp 825.000.000;Komplek benda Pamulang Bintaro Tangerang Selatan;Rumah Mewah murah Di Tangsel pamulang unit Ready;;;;
;2;54;;Rp 615.000.000;Sriwidari Sukabumi;Rumah Strategis Nyaman Tenang di Pusat Kota Sukabumi;;;;
;2;88;;Rp 850.000.000;Jalan Rambutan 3 Pekanbaru 28253 Indonesia Marpoyan Damai Pekanbaru;PERUMAHAN 2 LANTAI TENGAH KOTA;;;;
;5;300;;Rp 4.500.000.000;Dukuh Sutorejo Surabaya;(TANPA PERANTARA ) DI JUAL RUMAH AMAN DI PERUMAHAN SUTEREJO PRIMA;;;;
;3;78;;Rp 1.000.000.000;Daan Mogot Jakarta Barat;GREEN PARK VIEW bangun dan jual Rumah TOWN HOUSE 2 Lantai;;;;
;6;200;;Rp 2.100.000.000;Jl. Anggrek Rosliana V Kemanggisan Slipi Jakarta Barat Slipi Jakarta Barat;Jual rumah nyaman;;;;
;3;55;;Rp 580.000.000;Rancaekek Bandung;MEZANIN CLUSTER RANCAEKEK;;;;
;4;188;;Rp 1.025.000.000;Surabaya;DI JUAL RUMAH LUAS SIAP HUNI 1LT MULTIFUNGSI;;;;
;4;275;;Rp 4.850.000.000;Cluster Emerald Mansion Lippo Cikarang Bekasi;Jual Rumah Mewah Cluster Emerald Mansion Lippo Cikarang- Semi Furnish;;;;
;3;65;;Rp 1.300.000.000;jalan Raya Sliwangi Tangerang selatan Pondok Benda Baru Tangerang Selatan;Rumah bagus di pamulang tangsel;;;;
;2;36;;Rp 498.000.000;Gedangan Sidoarjo;Taman Sukodono Regency Tahap 4 Free DP Free Biaya2;;;;
;2;30;;Rp 449.000.000;jl jatihandap caheum Jatihandap Bandung;JARANG ADA RUMAH DIJUAL MURAH DI JATIHANDAP BANDUNG;;;;
;2;45;;Rp 385.000.000;Cibinong Bogor;Cluster 5 unit 300 jtan bonus canopy & AC dkat st pd rajeg di Cibinong;Aranya Park di Jakal KM 12 Yogyakarta dekat Kampus UII dan UGM.;;;
;2;36;;Rp 950.000.000;Jl. Raya Mabes TNI Pintu Delta 5. Perum Puri Cilangkap No 27 RT.05 Rw.06 Kelurahan Pondok Ranggon Kecamatan Cipayung. Jakarta Timur Cipayung Jakarta Timur;Dijual Murah Rumah Cluster Nyaman dan Adem di Cipayung Jak-tim;;;;
;2;40;;Rp 400.000.000;Baki Sukoharjo;perumahan solobaru;;;;
;4;132;;Rp 1.200.000.000;Rancasari Bandung;RUMAH DIJUAL BU DI MUSTIKA TOWNHOUSE DKT RS AL ISLAM;pasar induk cipinang;tol becakayu;;
;3;74;;Rp 1.086.600.000;Garuda Bandung;Rumah 2 Lantai Dalam Komplek Perumahan Elang Kota Bandung;;;;
;2;40;;Rp 250.000.000;Bedahan Depok;RUmah ready kpR dekat stasiun dan toll;;;;
;2;100;;Rp 1.100.000.000;Lebak Bulus Jakarta Selatan;Rumah Tinggal Cantik di lebak bulus jaksel;;;;
;4;101;;Rp 1.250.000.000;Cikeas Bogor;Rumah Asri di Grand Cibubur Country Cikeas - Agung Sedayu Grup;;;;
;2;50;;Rp 650.000.000;Gedebage Gedebage Bandung;Rumah Baru di Gedebage Kota Bandung dekat Pintu Tol;;;;
;2;40;;Rp 476.000.000;Jl. Komud ABD. Saleh Asrikaton Kec. Pakis Kab. Malang Pakis Malang;THE ARYA BANDARA;;;;
;2;40;;Rp 540.000.000;Benowo Surabaya;GRIYA CITRA ASRI; Full Furnished; Suasana Asri&Nyaman. Lokasi Strategis di Kodya Yogya;;
;2;40;;Rp 195.000.000;Mijen Semarang;RUMAH MURAH BISA KPR KWALITAS PREMIUM;;;;
;4;200;;Rp 2.700.000.000;Denpasar Utara Denpasar;rumah 2 lantai dikawasan jl cokroaminoto denpasar;;;;
;4;932;;Rp 10.499.000.000;Kebayoran Lama Jakarta Selatan;DI JUAL RUMAH LUAS TANAH 932m2 BEBAS BANJIR VETERAN BINTARO;;;;
;2;36;;Rp 525.000.000;Rungkut Surabaya;Rumah Baru Termurah di Medokan ayu Surabaya Timur. Bisa Inhouse; minimalis Lokasi Bitera Gianyar dapat view sawah;;;
;3;140;;Rp 1.650.000.000;Jagakarsa Jakarta Selatan;Benda Terrace Hunian Moderen Di Jagakarsa Jakarta Selatan;;;;
;4;150;;Rp 1.300.000.000;Tanjungsari Sumedang;Tanah Luas 530m2 Paling Murah di Sekitar;;;;
;2;36;;Rp 259.000.000;Ciparay Bandung;rumah KPRS DP 0 cicilan 1.9 jt dekat alun2 ciparay bandung;;;;
;5;200;;Rp 3.000.000.000;Banjarsari Solo;Jual Rumah Mewah Lingkungan Aman Nyaman Sumber Banjarsari;;;;
;2;150;;Rp 700.000.000;wisma pondok aren Jl. Merpati blok e16 Pondok Kacang Timur Tangerang;Dijual Rumah murah 2 lantai posisi di hook di Perumahan Pondok Maharta;;;;
;4;396;;Rp 7.500.000.000;Cipete Kebayoran Baru Jakarta Selatan;Dijual rumah Gaharu 2 Cipete kebayoran baru jakarta selatan;;;;
;2;45;;Rp 255.000.000;TIMUR PASAR JENANGAN Jenangan Ponorogo;RUMAH BARU DEKAT PASAR JENANGAN PONOROGO;;;;
;2;55;;Rp 1.200.000.000;Lippo Cikarang Bekasi;DIJUAL MURAH RUMAH BARU SIAP HUNI 2 LANTAI + 2AC + 1 KULKAS (BARU); Lt 144 m≤;;;
;7;200;;Rp 10.000.000.000;Kebayoran Baru Jakarta Selatan;Dijual Rumah Murah Jl Martimbang Raya Sinabung Kebayoran Baru Jaksel;;;;
;3;250;;Rp 4.000.000.000;Cilimus Kuningan;Rumah Kebun kawasan wisata;;;;
;2;58;;Rp 749.955.000;Talun (Cirebon Selatan) Cirebon;Cassablanca Residence Tipe Magnolia 58/84;;;;
;2;45;;Rp 495.000.000;Sawangan Depok;BU Harus Laku dijual bawah Harga pasaran;;;;
;5;550;;Rp 15.000.000.000;Mulyorejo Surabaya;Dijual Rumah Villa Royal;;;;
;10;150;;Rp 2.500.000.000;Cibitung Bekasi;Rumah Kost 20 kamar untuk investasi;;;;
;3;100;;Rp 1.600.000.000;Villa Kalijudan Indah Surabaya Kalijudan Surabaya;Rumah Fully Furnished Villa Kalijudan Indah Surabaya;;;;
;3;150;;Rp 800.000.000;Mangkujayan Ponorogo;RUMAH 2 LANTAI KOTA PONOROGO;;;;
;2;30;;Rp 278.092.000;Katapang Bandung;Ashfara permata sukamukti;;;;
;2;126;;Rp 1.200.000.000;Tandes Surabaya;jual rumah darmo indah timur;;;;
;4;124;;Rp 2.378.750.000;Jalan Raya Setu Cipayung Jakarta Timur;Beli Rumah Cantik FREE Yamaha N-Max 2Km dari JORR bisa KPR;;;;
;3;95;;Rp 1.395.000.000;Ngaglik Sleman;Dijual Rumah Baru Dekat UGM Jl Kaliurang Km.10 Jogja Yogyakarta;;;;
;2;110;;Rp 650.000.000;Parigi Tangerang;Dijual Rumah Cepat (BU);;;;
;2;36;;Rp 412.000.000;Ciomas Bogor;Rumah Cluster Baru Tanpa Dp;;;;
;3;63;;Rp 665.000.000;Lowokwaru Malang;Rumah 2 lantai area universitas Brawijaya Malang;;;;
;2;50;;Rp 700.000.000;Mulyorejo Dekat Pakuwon City Gubeng Surabaya;BARU FREE BIAYA MULYOSARI RUNGKUT RUMAH PAKUWON CITY SIAP HUNI MODERN;;;;
;3;88;;Rp 1.400.000.000;Cakung Jakarta Timur;Rumah Cantik model Eropa di kawasan Jakarta Timur;;;;
;3;7;;Rp 865.000.000;Depok Sleman;rumah dalam perumahan jogja;;;;
;2;41;;Rp 500.000.000;Kalisari Jakarta Timur;Rumah Cluster Murah Minimalis di Kalisari Pasar Rebo Jakarta Timur;;;;
;4;160;;Rp 2.250.000.000;Batam Center Batam;Rumah 2 lantai - Beverly Park Batam Center;;;;
;3;145;;Rp 850.000.000;Cimahi Cimahi;di jual rumah di cimahi dekat tol;;;;
;3;65;;Rp 795.000.000;Rungkut Surabaya;Rumah baru 3 kamar tidur 2 kamar mandi rungkut;;;;
;3;70;;Rp 695.000.000;Maguwoharjo Sleman;rumah murah deket jogja bay;;;;
;2;45;;Rp 800.000.000;Kemang Bogor Bogor;Kemang Eminence Bogor Termurah;;;;
;2;100;;Rp 999.000.000;Ciracas Jakarta Timur;Rumah Mewah murah dan strategis;;;;
;2;40;;Rp 886.206.908;Bojong Nangka Kec. Gn. Putri Kabupaten Bogor Jawa Barat 16963 Cibubur Jakarta Timur;The Lagoon Park Bukit Golf Riverside Cibubur type Evia;;;;
;3;65;;Rp 825.000.000;Jalan Soekarno Hatta Pekanbaru 28231 Indonesia Tampan Pekanbaru;PERUMAHAN MODERN TENGAH KOTA;;;;
;3;68;;Rp 795.000.000;Pondok Cibubur radar Auri Cimanggis Depok Cibubur Jakarta Timur;Rumah Cluster SHM Cicilan Ringan DP SUKA SUKA DEKAT TOL Cibubur;;;;
;2;30;;Rp 150.500.000;Ringinrejo Kediri;Rumah Subsidi Berkualitas;;;;
;2;54;;Rp 549.700.000;Oro-oro Ombo Batu;vila SHM & IMB on hand//2 menit wisata BNS;;;;
;2;45;;Rp 235.000.000;Karang Ploso Malang;DIJUAL RUMAH DI GPA NGIJO KARANGPLOSO;;;;
;2;51;;Rp 862.000.000;Cimanggis Depok;Rumah Cluster 2 Lantai Grand Tabebuya Cimanggis di Cimanggis Depok;;;;
;4;250;;Rp 4.000.000.000;Matoa Residence Jagakarsa Jakarta Selatan;DIJUAL HUNIAN NYAMAN UNIT BARU DI MATOA RESIDENCE; apik;lega;siap huni;
;2;36;;Rp 365.000.000;Sawangan Depok;non bi ceking;;;;
;3;63;;Rp 1.125.213.000;Cibubur Jakarta Timur;The Lagoon Park Bukit Golf Riverside Cibuburr;;;;
;5;180;;Rp 1.500.000.000;Koja Jakarta Utara;Rumah di jual di komplek PERUMPEL II;;;;
;7;650;;Rp 19.250.000.000;Lamandau 1 Kebayoran baru Kebayoran Baru Jakarta Selatan;Di jual rumah Lamandau 1 Kebayoran baru;;;;
;3;140;;Rp 849.000.000;Waru Sidoarjo;Rumah murah waru dijual dengan perabot;;;;
;3;76;;Rp 525.000.000;Medan Selayang Medan;Rumah Siap Huni 3 kmr 2kmd Jl Bunga stella 1 Simpang Selayang;;;;
;2;188;;Rp 3.700.000.000;Jl. Raya Kediri - Blitar Pule Utara Pule Kec. Kandat Kabupaten Kediri Jawa Timur 64173 Kandat Kediri;Dijual Rumah Joglo Cafe Siap Pakai;;;;
;4;278;;Rp 1.650.000.000;Sememi Surabaya;Jual rumah Western Regency Nol jalan Sememi Raya Surabaya;;;;
;2;42;;Rp 534.000.000;Kemayoran Jakarta Pusat;Rumah murah 2 lntai minimalis modern angkasa kemayoran jak pus;;;;
;4;300;;Rp 675.000.000;pulosari pandeglang citaman Mandalawangi Pandeglang;Villa Plus Kolam Ikan Pandeglang Mandalawangi;;;;
;5;600;;Rp 8.800.000.000;Pondok Kelapa Jakarta Timur;Jual Cepat Rumah Mewah Dalam Komplek Pondok Kelapa Indah;;;;
;2;55;;Rp 778.000.000;Karawaci Tangerang;RUMAH DI PUSAT KARAWACI DP 0% CICILAN 4jutaan;5;;;
;4;99;;Rp 2.500.000.000;Pekanbaru Kota Pekanbaru;Perumahan Mewah Mega Asri;;;;
;2;46;;Rp 470.000.000;Rawa Sari Jakarta Pusat;Akan launching cluster di Jakarta pusat;;;;
;2;28;;Rp 198.000.000;Cibitung Bekasi;Rumah Cluster Giandra Madani Residence;;;;
;2;29;;Rp 168.000.000;Cikarang Selatan Bekasi;RUMAH SUBSIDI DP CMN SATU JUTA LIMA RATUS RIBU;;;;
;2;80;;Rp 2.000.000.000;Kelapa Gading Jakarta Utara;Rumah Siap Huni Kelapa Gading Jakarta Utara Bisa Nego;;;;
;3;68;;Rp 790.000.000;Radar Auri cimanggis Pasar Rebo Jakarta Timur;rumah cluster nyaman asri shm dekat tol Cibubur;;;;
;2;30;;Rp 300.000.000;Sawangan Baru Depok;rumah cluster di sawangan depok KPR PRIBADI TANPA BANK;;;;
;2;45;;Rp 363.500.000;Pabelan Semarang;Rumah murah 300jtaan dekat kator kecamatan pabelan; Semarang ( Lz Tt 4464 );;;
;3;68;;Rp 1.005.600.000;Cipinang Jakarta Timur;Rumah di jual 2 lntai asri nan sejuk di Cipinang Jakarta timur;;;;
;3;54;;Rp 739.000.000;Jalan Besi Jangkang Sleman Indonesia Ngemplak Sleman;Rumah modern sleman dekat kampus UII;;;;
;7;390;;Rp 5.100.000.000;Condong Catur Sleman;Rumah di jual di jalan kaliurang km 7.8;;;;
;2;46;;Rp 500.000.000;Jalan Kartini Depok 16431 Indonesia Pancoran Mas Depok;Rumah cluster griya hana residence unit ready stok;;;;
;2;300;;Rp 1.900.000.000;Cimanggis Depok;Rumah siap huni Bukit Cengkeh1;;;;
;3;70;;Rp 670.000.000;Rungkut Surabaya;Rumah mewah perumahan Griya Ani murah;;;;
;3;100;;Rp 2.100.000.000;Jl. Rotella II No. 10 Pondok Ranji Ciputat Timur Tangerang Selatan Ciputat Tangerang Selatan;Dijual Rumah Lokasi Strategis ;;;;
;4;154;;Rp 750.000.000;Curug Tangerang;DIJUAL RUMAH DI TANGERANG MURAH DI GRIYA CURUG BISA DI KPR (TANPA DP);jatinegara;pulogadung;rsi cipinang;
;5;500;;Rp 6.000.000.000;Padang Galak Denpasar;VILLA JALAN KAKI KE PANTAI PADANG GALAK SANUR BALI;;;;
;2;33;;Rp 350.000.000;Kepanjen Malang;RUMAH KEPANJEN MURAH;;;;
;4;172;;Rp 1.950.000.000;Cibubur Jakarta Timur;Cluster murah mewah di timur jakarta;;;;
;3;65;;Rp 479.000.000;Pakis Malang;Rumah murah yang strategis di kabupaten malang dekat exit tol;;;;
;3;52;;Rp 495.000.000;Sedayu Bantul;BONUS PERABOTAN;;;;
;3;42;;Rp 361.000.000;Tambun Utara Bekasi;Dipasarkan rumah cluster;;;;
;2;55;;Rp 718.000.000;Cikarang Selatan Bekasi;Cendana Spark Grand Launching;;;;
;2;48;;Rp 888.000.000;Bukit Sangkal Palembang;Townhouse daerah celentang palembang; Surabaya Barat - Jawa Timur;;;
;4;156;;Rp 3.300.000.000;Meruya Jakarta Barat;Dijual Rumah di Botanical Residence Luas Tanah 108 m2 Lingkungan Bagus;;;;
;2;36;;Rp 260.000.000;Bojonggede Bogor;RUMAH DI JUAL AMANAH VILLAGE SUSUKAN BOJONGGEDE; Desain Klasik Tanpa Bi Cheking Tanpa Bank;;;
;3;152;;Rp 650.000.000;Cilodong Depok;DIJUAL RUMAH DI CILODONG;di Sleman Aranya Park Yogyakarta Type 86/122.;;;
;3;120;;Rp 2.850.000.000;Canggu Badung;Di Jual Villa Murah Full Furnished di Canggu Bali;;;;
;4;240;;Rp 1.100.000.000;Menteng VIII Jl.nasional gg.keluarga no.11 Medan Medan Tenggara Medan;Jual Rumah Menteng 7 Medan;;;;
;2;49;;Rp 1.500.000.000;Karangpilang Surabaya;Dijual Rumah Grand Harvest Surabaya;;;;
;5;700;;Rp 9.500.000.000;Bintaro Jakarta Selatan;DIJUAL CEPAT RUMAH PLUS KOS-KOSAN YANG PENUH DIHUNI;;;;
;2;40;;Rp 250.000.000;Citayam Depok;rumah mewah cash dan kpr;;;;
;3;106;;Rp 675.000.000;Gunungpati Semarang;Rumah baru mewah minimalis asri Unnes Semarang;;;;
;2;90;;Rp 540.000.000;Suko Sidoarjo;Dijual Rumah dekat di kota Sidoarjo;;;;
;4;200;;Rp 3.200.000.000;Jalan Budi Indah Bandung Kota 40143 Indonesia Setiabudi Bandung;Jual Rumah Siap Huni Minimalis Modern Budi Indah Bandung Utara;;;;
;4;138;;Rp 1.800.000.000;Pandanaran Hills Cluster Pandanaran Height Blok A 05 SambirotoTembalang Semarang Sambiroto Semarang;Jual Rugi harga baru 2;;;;
;2;60;;Rp 450.000.000;Curug Tangerang;Rumah di Griya karawaci siap huni full renovasi;;;;
;4;200;;Rp 15.000.000.000;Sukabumi;Dijual rumah Sukabumi lokasi strategis - Hitung harga tanah!!;;;;
;4;175;;Rp 2.423.200.000;Jl. Karya Wisata Komplek Jcity Cluster J Crown tipe Jade Medan Johor Medan;Rumah Hunian Mewah Elegant J City Tipe Jade;;;;
;2;60;;Rp 695.000.000;Pancoran Mas Depok;rumah baru dekat dengan pintu tol depok;;;;
;3;70;;Rp 490.000.000;Rajabasa Bandar Lampung;RUMAH SIAP HUNI STRATEGIS DEKAT KAMPUS UNILA;;;;
;3;68;;Rp 799.000.000;Radar auri cimanggis Depok Cipayung Jakarta Timur;Rumah Cluster Proyek ke;;;;
;7;135;;Rp 8.900.000.000;Serengan Solo;Dijual Rumah Dengan Lahan Luas di Solo;;;;
;5;550;;Rp 11.000.000.000;Cilandak Jakarta Selatan;Jual Rumah mewah murah di Cilandak;;;;
;3;48;;Rp 1.550.000.000;Berbah Sleman;Jual Rumah Murah di Sleman - Yogyakarta;;;;
;2;50;;Rp 300.000.000;pakintelan 1 gunungpati semarang Pakintelan Semarang;rumah murah siap buni pakintelan;;;;
;2;45;;Rp 370.000.000;Banjarbaru;Rumah Siap Huni Lokasi Sangat Strategis Harga Murah di Banjarbaru;;;;
;3;85;;Rp 950.000.000;Oro-oro Ombo Batu;villa di Kota Batu di jual lokasi 1km dari BNS;;;;
;2;36;;Rp 525.000.000;Perumahan metro serpong 1blok A4 NO 21 Desa Cibogo kec cisauk kabupaten serpong Gading Serpong Tangerang;rumah murah di cisauk serpong;;;;
;4;250;;Rp 3.700.000.000;Cakung Jakarta Timur;Rumah Komplek DPR Cakung Pulogebang Jakarta Timur; larangan-ciledug;;;
;24;552;;Rp 8.500.000.000;Depok Sleman;Kost Exclusive 24kt Pogung dlm Ringroad dkt UGM income upto 50jt per bln;;;;
;2;36;;Rp 165.000.000;Maja Lebak;Jual Rumah Murah;;;;
;4;125;;Rp 1.699.750.000;Arcamanik Cisaranten kulon Arcamanik Bandung;Rumah Baru 2 lantai Arcamanik Bandung Timur Cisaranten Kulon dekat antapani;;;;
;4;45;;Rp 900.000.000;Ciledug Tangerang;Jual Rumah Murah;;;;
;1;60;;Rp 250.000.000;Setu Bekasi;rumah bekasi timur dekat akses toll jorr2;;;;
;2;36;;Rp 479.000.000;Cinunuk Cileunyi Cileunyi Bandung;Rumah Baru Dp Ringan 25jt all In s.d terima kunci cicilan 2.6jt/bln;;;;
;4;350;;Rp 50.000.000.000;Kebayoran Baru Jakarta Selatan;Rumah dijual Jl. Dharmawangsa Panglima Polim Prapanca kebayoran baru jakarta sel;;;;
;2;30;;Rp 360.000.000;Kemang Tonjong Bogor;Rumah Ready Stock Termurah;;;;
;4;150;;Rp 1.649.000.000;Cilandak Jakarta Selatan;Dijual rumah baru AKSES STRATEGIS DEKAT TOL DESARI;;;;
;3;89;;Rp 1.190.000.000;Jl. Rorotan VII Malaka III HB No.36 RT.12/RW.5 Rorotan Kec. Cilincing Kota Jkt Utara Daerah Khusus Ibukota Jakarta 14140 Rorotan Jakarta Utara;Nusa Kirana Rorotan Cakung 2 Lantai;;;;
;4;150;;Rp 3.200.000.000;Jl Perkici Bintaro sektor 5 Bintaro Tangerang Selatan;Dijual Rumah di Jl Perkici ;;;;
;2;50;;Rp 355.000.000;Sukoharjo Sukoharjo;Rumah Baru di lokasi cluster kecil;;;;
;3;40;;Rp 265.000.000;Lawang Malang;Rumah 2 Lantai 200jtan di Lawang Malang;;;;
;4;124;;Rp 1.200.000.000;Tangerang;DI JUAL RUMAH LAVON MURAH KONSEP DOUBLE DECKER;;;;
;3;50;;Rp 395.000.000;Kemuning Palembang;perumahan di tanjung barangan 5 juta All in;;;;
;4;103;;Rp 1.400.000.000;Pakal Surabaya;PROMO Dijual Rumah CitraLand Surabaya DP 0%;;;;
;10;6000;;Rp 15.000.000.000;Lembang Bandung;PETERNAKAN SAPI PERAH SEKALIGUS VILLA LEMBANG ( MILIK SENDIRI );;;;
;3;96;;Rp 1.810.000.000;Mijen Semarang;Kedaton BSBCity;;;;
;4;497;;Rp 20.000.000.000;Dago Bandung;JUAL cepat Rumah/Vila Mevvah di Dago FURNISH;;;;
;2;39;;Rp 538.000.000;Plaju Palembang;VILLA MALIBU PROMO MERDEKA;;;;
